Drama Name,Timestamp,Urdu Subtitle,Urdu Length,English Subtitle,English Length,Episode,Genre
Band Baj Gaya,00:00:11.110,تم نے کیا سوچا تھا,5,What did you think,4,,
Band Baj Gaya,00:00:14.740,کچھ ہو رہا ہے وہ ہوتا رہے گا ایسا,9,Whatever is going on will keep going on,8,,
Band Baj Gaya,00:00:18.500,نہیں ہے ایسا نہیں ہونے والا ہے,7,It's not like that,4,,
Band Baj Gaya,00:00:22.180,زیادہ خوش نہ ہو,4,Don't be too happy,4,,
Band Baj Gaya,00:00:26.160,پیارے دوست تم خود ہو گئے ہو برباد ہو اوہ برباد ہو تم برباد ہو اوہ برباد ہو تم برباد ہو تم,22,Dear friend you have been yourself,6,,
Band Baj Gaya,00:00:44.360,برباد ہو,2,You are doomed,3,,
Band Baj Gaya,00:00:53.670,آپ اس لڑکی کے بارے میں,6,You don't know anything about that girl,7,,
Band Baj Gaya,00:00:58.740,اور ہم,2,And we are ogling girls right in the middle,9,,
Band Baj Gaya,00:01:02.520,یہ کیا [ __ ] ہے؟,6,What the hell is this?,5,,
Band Baj Gaya,00:01:04.550,کیوں ابل رہے ہو؟  ایسا,5,Why are you boiling?,4,,
Band Baj Gaya,00:01:08.110,وہ میری چاہنے والی ہے، یار!,6,"She is my crush, man!",5,,
Band Baj Gaya,00:01:10.760,اذان، یہ,2,"Azan, it must be",4,,
Band Baj Gaya,00:01:13.860,لوگ دیکھ رہے ہوں گے کہ ہم,7,People must be noticing that we,6,,
Band Baj Gaya,00:01:17.940,بہت اچھا۔  لڑکی,3,Just great. The girl,4,,
Band Baj Gaya,00:01:19.560,اور کوئی دیکھے گا,4,and someone would notice,4,,
Band Baj Gaya,00:01:22.900,بہت مضحکہ خیز۔  ایک ویڈیو ریکارڈ کریں اور انٹرنیٹ پر اپ لوڈ کریں،,13,So funny. Record a video and upload,7,,
Band Baj Gaya,00:01:28.070,اوہ، واہ، مجھے یہ خیال پہلے کیوں نہیں آیا؟,9,"Oh, wow, why didn't I get this idea before?",9,,
Band Baj Gaya,00:01:32.300,یہاں، میں ابھی ایک ویڈیو بناتا ہوں,7,"Here, let me make a video",6,,
Band Baj Gaya,00:01:35.160,کہ میرا سب سے اچھا دوست مجھے,7,that my best friend has brought me,7,,
Band Baj Gaya,00:01:38.810,تم پاگل ہو؟  اگر باپ نے,6,Are you mad? If father sees,6,,
Band Baj Gaya,00:01:42.690,وہ پہلے ہی سوچتا ہے کہ میں ایک اوگلر ہوں۔,10,He already thinks that I'm an ogler.,7,,
Band Baj Gaya,00:01:44.640,دیکھو تم ایک اوگلر ہو۔,5,Look you are an ogler.,5,,
Band Baj Gaya,00:01:48.800,دیکھو مجھے تمہاری ساری مایوسی ہو گئی ہے۔,8,Look I get all your frustration.,6,,
Band Baj Gaya,00:01:51.710,بس دس منٹ انتظار کرو،,5,"Just wait for ten minutes,",5,,
Band Baj Gaya,00:01:54.260,یار، میں اسی بات پر ناراض ہوں,7,"Man, that's what I'm angry about",6,,
Band Baj Gaya,00:01:56.340,کہ تمہیں یقین بھی نہیں ہے,6,that you aren't even sure,5,,
Band Baj Gaya,00:01:59.930,دیکھو میں نے اسے,4,"Look, I've seen her get back",6,,
Band Baj Gaya,00:02:03.720,اور مجھے لگتا ہے کہ یہ اس کا معمول ہے۔,10,And I think that this is her routine.,8,,
Band Baj Gaya,00:02:06.650,ایک بات بتاؤ وہ,4,"Tell me one thing, what is she going to do",10,,
Band Baj Gaya,00:02:11.540,اوہ، شاید اسے رات کی ڈیوٹی ملی ہے,8,"Oh, maybe she has got a night duty",8,,
Band Baj Gaya,00:02:15.490,اور اس وقت واپس آگئی ہے۔,6,and gets back at this hour.,6,,
Band Baj Gaya,00:02:17.620,"لفظ ""ہو سکتا ہے""",4,"Word ""may be"" can fit",5,,
Band Baj Gaya,00:02:21.430,تم اس کے بارے میں کیا جانتے ہو؟,8,What do you even know about her?,7,,
Band Baj Gaya,00:02:23.370,اگر وہ بہری اور گونگی ہے تو کیا ہوگا؟,9,What if she is deaf and dumb?,7,,
Band Baj Gaya,00:02:25.970,اور اگر وہ پہلے سے شادی شدہ ہے,8,And what if she is already married,7,,
Band Baj Gaya,00:02:27.770,اور گھر کے اندر اپنے شوہر سے لڑ رہی ہے تو,11,and fighting with her husband,5,,
Band Baj Gaya,00:02:31.450,مجھے نہیں معلوم کہ اس ملعون,6,I don't know if the expenses of this cursed,9,,
Band Baj Gaya,00:02:36.250,یہاں تک کہ اس کا نمبر بھی اتنا خطرناک ہے۔,10,Even it's number is so dangerous.,6,,
Band Baj Gaya,00:02:39.600,اس ایک گھر کو چلانے کے لیے,7,"To run this single house,",5,,
Band Baj Gaya,00:02:43.760,*,1,*,1,,
Band Baj Gaya,00:02:45.210,مجھے بس یہ سمجھ نہیں آرہی,6,I just don't understand,4,,
Band Baj Gaya,00:02:49.110,اور ہم,2,and we charge,3,,
Band Baj Gaya,00:02:52.280,پھر بھی پتہ نہیں,4,even then I don't know why,6,,
Band Baj Gaya,00:02:55.400,اور تم، کیا تم سن رہے ہو جو,8,"And you, are you listening",5,,
Band Baj Gaya,00:03:00.120,ہاں، کان آپ کی طرف متوجہ ہیں۔,7,"Yeah, ears are attentive towards you.",6,,
Band Baj Gaya,00:03:03.690,-کیا؟  - وہ,3,-What?,1,,
Band Baj Gaya,00:03:06.840,[ __ ].,3,Nonsense.,1,,
Band Baj Gaya,00:03:08.890,ایک بات بتاؤ کیا,4,"Tell me one thing,",4,,
Band Baj Gaya,00:03:11.900,تمھارا سمعان سے کوئی افیئر ہے؟,6,are you having an affair with Saman?,7,,
Band Baj Gaya,00:03:20.620,کیا بات کر رہے ہو؟,5,What are you talking about?,5,,
Band Baj Gaya,00:03:22.720,میرا مطلب ہے کہ میں,5,"I mean, that I have been noticing",7,,
Band Baj Gaya,00:03:25.590,آپ جو مسکراہٹیں ایک دوسرے کو دیکھتے ہیں۔,8,the smiles you pass at each other.,7,,
Band Baj Gaya,00:03:29.440,اوہ آؤ۔,2,"Oh, come on.",3,,
Band Baj Gaya,00:03:31.160,ہم ایک ہی گھر میں رہتے ہیں،,7,"we live in the same house,",6,,
Band Baj Gaya,00:03:34.280,اب اگر ہم گزرتے ہوئے ایک دوسرے کو دیکھ کر مسکرائیں,11,Now if we smile at each other while,8,,
Band Baj Gaya,00:03:37.280,اس میں کیا حرج ہے؟,5,what's wrong with that?,4,,
Band Baj Gaya,00:03:39.330,میں اس مسکراہٹ کی بات نہیں کر رہا، سرشار۔,9,"I'm not talking about that smile, Sarshaar.",7,,
Band Baj Gaya,00:03:42.670,پھر کس مسکراہٹ کی بات کر رہے ہو؟,8,Then which smile are you talking about?,7,,
Band Baj Gaya,00:03:46.220,میں تمہاری بیوی ہوں  کیا میں نہیں جانوں گا کہ,10,I'm your wife. Wouldn't I know,6,,
Band Baj Gaya,00:03:51.870,یہ تمام اضافی رقم,4,All this extra amount,4,,
Band Baj Gaya,00:03:55.370,میں تم سے کہہ رہا ہوں کہ اسے,8,I am telling you to ask her,7,,
Band Baj Gaya,00:04:00.100,ٹھیک ہے، ٹھیک ہے، میں ابھی جا کر,8,"Okay, fine, I'll go now",5,,
Band Baj Gaya,00:04:03.500,اپنا سامان باندھ کر چلا جائے۔,6,to pack her stuff and leave.,6,,
Band Baj Gaya,00:04:06.840,"اور جو 16,000/- آپ ہمیں",5,"And the 16,000/- you're giving us",6,,
Band Baj Gaya,00:04:12.120,ٹھیک ہے، سنو، کیا ہم دوسرا کرایہ دار نہیں رکھ سکتے؟,11,"Okay, listen, can't we keep another tenant?",7,,
Band Baj Gaya,00:04:16.580,ہاں ہم کر سکتے ہیں لیکن ذرا سوچیں کہ,9,"Yes we can, but just think",6,,
Band Baj Gaya,00:04:25.330,اب ہمیں بڑی مشکل سے ایک اچھی، با,8,"Now we have found a nice,",6,,
Band Baj Gaya,00:04:29.640,جو باقاعدگی سے کرایہ ادا کر رہی ہے۔,8,who is paying rent regularly too.,6,,
Band Baj Gaya,00:04:31.200,ورنہ ہماری حالت ٹھیک نہیں ہے۔,6,Otherwise our condition isn't good.,5,,
Band Baj Gaya,00:04:33.400,ضرور آگے بڑھیں، اس کی تعریف کرتے رہیں۔,8,"Sure go ahead, keep praising her.",6,,
Band Baj Gaya,00:04:37.210,وہ شریف، کردار ہے,4,"She is noble, characterful",4,,
Band Baj Gaya,00:04:42.030,-آپ؟  تم... -,3,-You? You...,2,,
Band Baj Gaya,00:04:44.840,میری بات غور سے سنو،,5,"Listen to me carefully,",4,,
Band Baj Gaya,00:04:46.980,اس لڑکی کا معاہدہ ختم ہو گیا ہے,8,that girl's contract is over,5,,
Band Baj Gaya,00:04:51.500,اسی لیے ہم,3,That's why we are going,5,,
Band Baj Gaya,00:04:54.440,اپنے دادا کو فوراً کال کریں،,6,"Call your grandpa right away,",5,,
Band Baj Gaya,00:04:56.910,جو,1,who makes calculations,3,,
Band Baj Gaya,00:04:59.730,مجھے یقین ہے کہ وہ بھی ایک exorcist ہوگا۔,9,I'm sure he must be an exorcist too.,8,,
Band Baj Gaya,00:05:02.380,اس سے کہو کہ تم میں,6,Tell him that you are possessed,6,,
Band Baj Gaya,00:05:05.990,صرف فون کے ذریعے اڑا,5,Just blow through the phone,5,,
Band Baj Gaya,00:05:08.140,سرشار، یہ تمہاری آخری وارننگ ہے۔,6,"Sarshaar, this is your last warning.",6,,
Band Baj Gaya,00:05:11.420,اس لڑکی کو گھر سے نکال دو ورنہ... اور,9,Get this girl out of the house or else...,9,,
Band Baj Gaya,00:05:13.490,کیا؟  آپ سب سے زیادہ کیا کر سکتے ہیں؟,9,What else? What's the most you can do?,8,,
Band Baj Gaya,00:05:18.090,ورنہ میں جا رہا ہوں...,5,Or else I am going to...,6,,
Band Baj Gaya,00:05:23.710,واقعی؟  اور کم سے کم کیا ہے؟,7,Really? And what's the least?,5,,
Band Baj Gaya,00:05:26.200,کم سے کم؟,3,The least?,2,,
Band Baj Gaya,00:05:29.140,میں آپ کی وہ تصویر اپ لوڈ کرنے جا رہا ہوں جس,12,I'm going to upload that picture of yours,8,,
Band Baj Gaya,00:05:33.980,اوہ، آدمی، مکروہ!,3,"Oh, man, disgusting!",3,,
Band Baj Gaya,00:05:37.380,تم برباد ہو اوہ,4,You are doomed,3,,
Band Baj Gaya,00:05:42.910,تم برباد ہو اوہ,4,You are doomed,3,,
Band Baj Gaya,00:05:46.680,ڈولی مجھے,2,"Dolly, I want such",4,,
Band Baj Gaya,00:05:50.410,دیکھ کر میں سب کچھ بھول جاؤں,7,by looking at whom I forget everything.,7,,
Band Baj Gaya,00:05:57.140,بالکل اسی طرح۔,3,just like that.,3,,
Band Baj Gaya,00:05:58.380,ابھی آپ صرف یہ بتا رہے ہیں,7,Right now you are just explaining,6,,
Band Baj Gaya,00:06:00.500,کہ آپ صرف ایک اوگلر ہی نہیں ہیں بلکہ ایک بہت بڑا,12,that you aren't just an ogler but a huge,9,,
Band Baj Gaya,00:06:04.500,نہیں میں صرف دلیل دے رہا تھا۔,7,"No, I was just giving an argument.",7,,
Band Baj Gaya,00:06:07.670,تم مجھے یہاں,3,You brought me here,4,,
Band Baj Gaya,00:06:10.200,جس کے بارے میں تم,5,about whom you don't know,5,,
Band Baj Gaya,00:06:13.730,اور تم نے اس کو گلے لگانے کے علاوہ,9,And other than ogling her,5,,
Band Baj Gaya,00:06:17.060,اور ہم یہاں,3,And we are getting distressed here,6,,
Band Baj Gaya,00:06:21.240,اور میں یہ اچھی طرح جانتا ہوں,7,And I know it very well,6,,
Band Baj Gaya,00:06:22.800,کہ جب آپ آخرکار,4,that when you are finally going to,7,,
Band Baj Gaya,00:06:24.780,تو آپ معصومیت سے کہیں گے کہ,7,then you are going to say innocently that,8,,
Band Baj Gaya,00:06:28.840,اگر آپ کو میری طرف سے اتنے مسائل ہیں تو,10,If you have so much issues by me ogling,9,,
Band Baj Gaya,00:06:33.090,پھر تم مجھ سے شادی کر لو۔,7,You marry me then.,4,,
Band Baj Gaya,00:06:34.590,کیا؟  تم نے کبھی,4,What? Have you ever,4,,
Band Baj Gaya,00:06:36.160,تم اس قابل ہو کہ,5,are you even worth that,5,,
Band Baj Gaya,00:06:38.620,کیوں؟  یہ میرے چہرے کے ساتھ کیا ہے؟,8,Why? What is it with my face?,7,,
Band Baj Gaya,00:06:42.190,آپ نے ابھی اپنا کیریئر بنانا ہے،,7,"You have yet to build your career,",7,,
Band Baj Gaya,00:06:44.190,آپ کا GPA زمین کو چھو رہا ہے، آپ کو,10,"your GPA is touching the ground, you can't",8,,
Band Baj Gaya,00:06:48.580,آپ صرف ایک آزاد سوار ہیں جو,7,You are just a free rider living,7,,
Band Baj Gaya,00:06:51.510,اور بتاؤ تم,3,And tell me where are you going,7,,
Band Baj Gaya,00:06:55.410,ٹھیک ہے، مجھے بھول جاؤ، تم,6,"Okay, forget about me, where are you going",8,,
Band Baj Gaya,00:06:59.100,لاہور میں اپنے والد کے ساتھ؟,6,With your dad in Lahore?,5,,
Band Baj Gaya,00:07:01.240,جو اپنے بیٹے کو اچھی نوکری ملنے کے انتظار میں پلاٹ کے بعد پلاٹ بیچ رہا ہے۔,17,Who is selling plot after plot waiting,7,,
Band Baj Gaya,00:07:07.230,یار کیا میں اتنا ہارا ہوا ہوں؟  مجھے کوئی اندازہ نہیں تھا۔,12,"Man, am I such a loser? I had no idea.",10,,
Band Baj Gaya,00:07:11.470,لیکن آپ کو اندازہ نہیں ہے کہ,7,But you have no idea,5,,
Band Baj Gaya,00:07:15.760,میں آپ کے مستقبل کے تمام منصوبے جانتا ہوں,9,I know all your future plans,6,,
Band Baj Gaya,00:07:20.510,دیکھو، مجھے لگتا ہے کہ وہ آ رہی ہے۔,9,"Look, I think she's coming.",5,,
Band Baj Gaya,00:07:28.260,ذرا دیکھو، جب وہ گاڑی سے اترے گی,8,"Just see, when she'll get out of the car",9,,
Band Baj Gaya,00:07:47.700,میں اس میں کیا دیکھوں؟  وہ بہت تاریک ہے۔,9,What shall I see in her? She's so dark.,9,,
Band Baj Gaya,00:07:50.970,آپ کو حسد محسوس ہورہا ہوگا، ٹھیک ہے؟,8,"You must be feeling jealous, right?",6,,
Band Baj Gaya,00:07:53.040,نہیں، وہ دراصل اندھیرا ہے، ذرا اسے دیکھو۔,8,"No, she is actually dark, just look at her.",9,,
Band Baj Gaya,00:07:56.380,اب آپ اور بھی جلن ہونے لگے ہیں۔,8,Now you are getting even more jealous.,7,,
Band Baj Gaya,00:07:59.370,اوہ، تو کیا تم,4,"Oh, so did you bring me here",7,,
Band Baj Gaya,00:08:03.390,نہیں میں تمہیں یہاں حسد کرنے کے لیے نہیں لایا۔,10,No I didn't bring you here to get jealous.,9,,
Band Baj Gaya,00:08:06.690,اور میں اسے پرپوز کرنے جا رہا ہوں۔,8,and I'm going to propose her.,6,,
Band Baj Gaya,00:08:08.560,اور تم میرے ساتھ آ رہے ہو۔,7,And you are coming with me.,6,,
Band Baj Gaya,00:08:10.840,-کیا؟,1,-What?,1,,
Band Baj Gaya,00:08:14.090,کوئی گھر ہے؟,3,Anybody home?,2,,
Band Baj Gaya,00:08:17.900,اوہ، ہیلو، آپ کا دن کیسا رہا؟,7,"Oh, hi, how was your day?",6,,
Band Baj Gaya,00:08:20.800,یہ لاجواب تھا۔,3,It was fantastic.,3,,
Band Baj Gaya,00:08:23.590,تم نہ بتاؤ تب بھی مجھے کوئی فرق نہیں پڑتا۔,10,I don't care even if you don't tell.,8,,
Band Baj Gaya,00:08:30.090,سمعان تم واپس آگئے؟,4,"Saman, you're back?",3,,
Band Baj Gaya,00:08:31.420,سرشار، تم نے دیکھا کہ وہ مجھ سے کیسے بات کرتی ہے؟,12,"Sarshaar, did you see how she talks to me?",9,,
Band Baj Gaya,00:08:35.270,اب بیچاری نے تم سے کیا کہا؟,7,Now what did poor her say to you?,8,,
Band Baj Gaya,00:08:37.630,غریب؟,1,Poor? From which angle,4,,
Band Baj Gaya,00:08:40.920,وہ آپ کو ہر وقت گن پوائنٹ پر رکھتی ہے,10,She keeps you at gun point,6,,
Band Baj Gaya,00:08:45.230,ذرا دیکھ لیں,3,"Just check it out,",4,,
Band Baj Gaya,00:08:46.930,کہ اس خطرناک بیوی کے سامنے,6,"that in front of that dangerous wife,",7,,
Band Baj Gaya,00:08:48.900,میں نے اپنی دوسری بیوی کو,6,I have kept my second wife under,7,,
Band Baj Gaya,00:08:52.040,حالانکہ میں جانتا ہوں، جس دن اسے,7,"Although I know, the day she gets to",8,,
Band Baj Gaya,00:08:55.790,ذرا میرا اعتماد چیک کریں۔,5,Just check my confidence.,4,,
Band Baj Gaya,00:08:57.450,واہ، پہاڑ جیسا مضبوط اعتماد۔,5,"Wow, confidence a strong as a mountain.",7,,
Band Baj Gaya,00:09:03.110,- ہاں، لیکن صرف ایک مسئلہ ہے۔,7,"-Yeah, but there is just one issue.",7,,
Band Baj Gaya,00:09:07.700,اس نے,2,She has denied to extend,5,,
Band Baj Gaya,00:09:12.640,اچھا، یہ ایک اچھی خبر ہے۔,6,"Nice, that's a good news.",5,,
Band Baj Gaya,00:09:15.600,اب ہم آپ کے,4,Now we'll get to know about your,7,,
Band Baj Gaya,00:09:20.770,کیونکہ میں یہاں سے کہیں نہیں جا رہا ہوں۔,9,Because I am not going anywhere from here.,8,,
Band Baj Gaya,00:09:24.980,تم برباد ہو,3,You are doomed,3,,
Band Baj Gaya,00:09:28.670,تم برباد ہو,3,You are doomed,3,,
Band Baj Gaya,00:09:32.430,دیکھو، اس پر ایک بار پھر سوچو۔,7,"Look, think over it once more.",6,,
Band Baj Gaya,00:09:35.570,تم یہ بھی نہیں جانتے کہ,6,You don't even know,4,,
Band Baj Gaya,00:09:38.110,اور اگر وہ پہلے سے شادی شدہ ہے تو,9,"And what if she is already married,",7,,
Band Baj Gaya,00:09:41.760,اس سے ملیں اور تمام معلومات حاصل کریں۔,8,Meet her and get all the information.,7,,
Band Baj Gaya,00:09:43.970,اور صرف مجھے اشارہ کریں کہ,6,And just signal me,4,,
Band Baj Gaya,00:09:53.580,اگر میں اسے پرپوز نہ کرنے کے لیے چیخوں گا تو,11,If I am going to yell not to propose,9,,
Band Baj Gaya,00:09:59.910,پھر کیوں جھگڑ رہے ہو؟,5,Why are you arguing then?,5,,
Band Baj Gaya,00:10:03.490,معاف کیجئے گا آپ لوگ کون ہیں؟,7,"Excuse me, who are you guys?",6,,
Band Baj Gaya,00:10:06.260,اصل میں، میں ہوں، میرا مطلب ہے کہ ہم ہم ہیں۔,11,"Actually, I am, I mean we are we.",8,,
Band Baj Gaya,00:10:12.620,یہ کیا ہے ہم، وہ، آپ؟  تم لوگ کون ہو؟,10,"What's this we, her, you? Who are you guys?",9,,
Band Baj Gaya,00:10:16.670,دراصل، وہ آپ کے سامنے الجھ گیا,7,"Actually, he got confused in front of you",8,,
Band Baj Gaya,00:10:20.300,کیونکہ وہ کون سمجھ رہا ہے کہ آپ وہ نہیں ہیں۔,11,because who he is thinking you aren't her.,8,,
Band Baj Gaya,00:10:23.790,میں وہ نہیں ہوں؟,4,I'm not her?,3,,
Band Baj Gaya,00:10:25.610,تو میں کون ہوں؟,4,So who am I?,4,,
Band Baj Gaya,00:10:30.070,وہ جو تھوڑی دیر پہلے اندر گئی تھی،,8,"The one who went inside a while ago,",8,,
Band Baj Gaya,00:10:34.590,نہیں میرا اس سے کوئی رشتہ نہیں ہے۔,8,"No, I've got no relation with her.",7,,
Band Baj Gaya,00:10:38.930,-اوہ، ٹھیک ہے، ادائیگی کرنے والے مہمان۔,7,"-Oh, okay, paying guest.",4,,
Band Baj Gaya,00:10:43.810,میں نے پوچھا تم لوگ کون ہو؟,7,I asked who you guys are?,6,,
Band Baj Gaya,00:10:46.880,ہم ایک اپارٹمنٹ کی تلاش میں آئے تھے، مجھے لگتا ہے کہ,12,"We came looking for an apartment, I think",8,,
Band Baj Gaya,00:10:51.260,لیکن آپ کا اپارٹمنٹ پہلے ہی,6,But you apartment has already,5,,
Band Baj Gaya,00:10:54.970,تو ہم چلے جائیں گے۔  - چلو چلتے ہیں  -,10,So we shall leave.,4,,
Band Baj Gaya,00:10:59.300,وہ جو میں نہیں ہوں اور جو,7,"The one I am not, and the one",8,,
Band Baj Gaya,00:11:04.730,اور تم بتاؤ,3,And you tell me what do,6,,
Band Baj Gaya,00:11:09.010,اوہ، ہم پکڑے گئے ہیں۔,5,"Oh, we're caught.",3,,
Band Baj Gaya,00:11:12.270,دراصل ہم اسے دیکھ کر ہی سمجھ گئے,8,Actually we understood just by looking,6,,
Band Baj Gaya,00:11:19.880,دراصل *، چہرہ پڑھنا جانتا ہے۔,6,"Actually *, knows face-reading.",4,,
Band Baj Gaya,00:11:22.210,تو اس نے مجھے پہلے ہی بتا دیا تھا کہ جو لڑکی,12,So she already told me that the girl who,9,,
Band Baj Gaya,00:11:26.380,اور اس نے 100 روپے کی شرط بھی لگائی۔,9,And she even made a bet of 100 rupees.,9,,
Band Baj Gaya,00:11:31.730,اوہ، واقعی؟  میں واقعی میں,5,"Oh, really? I really",4,,
Band Baj Gaya,00:11:35.420,کیا آپ مجھے سکھائیں گے؟,5,Will you teach me?,4,,
Band Baj Gaya,00:11:36.980,ہاں ضرور، وہ تمہیں سکھائے گی۔,6,"Yeah sure, she'll teach you.",5,,
Band Baj Gaya,00:11:39.200,-ہاں؟,1,-Yes?,1,,
Band Baj Gaya,00:11:41.900,آپ کو اپارٹمنٹ چاہیے یا نہیں؟,6,Do you want an apartment or not?,7,,
Band Baj Gaya,00:11:44.590,ہاں، میں کرتا ہوں۔,4,"Yes, I do.",3,,
Band Baj Gaya,00:11:46.820,کیا؟  آپ کا کیا مطلب ہے میں کرتا ہوں؟  کیا,10,What? What do you mean I do?,7,,
Band Baj Gaya,00:11:49.610,تم لوگ ساتھ نہیں ہو؟,5,Aren't you guys together?,4,,
Band Baj Gaya,00:11:51.750,دیکھو ہم اپنا اپارٹمنٹ,4,Look we rent out our apartment,6,,
Band Baj Gaya,00:11:56.070,نہیں، نہیں، وہ خاندان، وہ خاندان،,6,"No, no, he family, she family,",6,,
Band Baj Gaya,00:12:00.330,اور وہ,2,And she is going,4,,
Band Baj Gaya,00:12:04.320,ہاں، وہ کرے گی، وہ کرے گی۔,7,"Yes, she will, she will.",5,,
Band Baj Gaya,00:12:06.140,-ٹھیک ہے۔,2,-Okay.,1,,
Band Baj Gaya,00:12:08.030,- ٹھیک ہے تو چلو میرے ساتھ۔  - چلو چلتے ہیں,11,"-Okay then, come with me.",5,,
Band Baj Gaya,00:12:19.170,آپ اتنے غصے میں کیوں ہیں؟,6,Why are you so angry?,5,,
Band Baj Gaya,00:12:22.070,ٹھیک ہے چھوڑو میں,4,"Okay, leave it, I'm going",5,,
Band Baj Gaya,00:12:28.120,میرا ہاتھ چھوڑو۔  میں نے,5,-Leave my hand.,3,,
Band Baj Gaya,00:12:32.480,سرشار۔,1,Sarshaar.,1,,
Band Baj Gaya,00:12:34.760,سرشار، سرشار۔,2,"Sarshaar, Sarshaar.",2,,
Band Baj Gaya,00:12:37.540,وہ اتنی جلدی واپس کیسے آگئی؟,6,How did she get back so soon?,7,,
Band Baj Gaya,00:12:40.440,اور تم اور میں یہاں ایک ساتھ...,7,And you and me here together...,6,,
Band Baj Gaya,00:12:42.890,میں کیا کہنے جا رہا ہوں؟,6,What am I going to say?,6,,
Band Baj Gaya,00:12:45.090,ٹھیک ہے ایک یہ کرو، یہیں رہو،,7,"Okay do one this, stay here,",6,,
Band Baj Gaya,00:12:48.500,میں باہر نہیں آرہا، تم آگے بڑھو۔,7,"I'm not coming out, you go ahead.",7,,
Band Baj Gaya,00:12:51.970,-Henpecked-شوہر۔,1,-Henpecked-husband.,1,,
Band Baj Gaya,00:12:58.520,ارے جیا تم اتنی جلدی واپس آگئی ہو؟,8,"Hey, Jia, you are back so soon?",7,,
Band Baj Gaya,00:13:04.910,وہ نئے کرایہ دار ہیں۔,5,They are the new tenants.,5,,
Band Baj Gaya,00:13:08.440,اور میں آج کام پر نہیں جا رہا ہوں۔  میں,10,And I'm not going to work today. I will,9,,
Band Baj Gaya,00:13:12.970,وہ اب یہاں سے ہی رہیں گے۔  -,8,They will stay here from now own.,7,,
Band Baj Gaya,00:13:19.180,معاف کیجئے گا۔  -,4,-Excuse me.,2,,
Band Baj Gaya,00:13:24.220,اور تم، کیا تم نے اسے کہا کہ وہ اپنا بیگ پیک کرے؟,13,"And you, did you tell her to pack her bags?",10,,
Band Baj Gaya,00:13:34.320,اس سے کہو کہ,4,Tell her to go away from,6,,
Band Baj Gaya,00:13:38.060,دیکھو,1,Let me see who is going,6,,
Band Baj Gaya,00:13:41.450,تم کچن میں کیا کر رہی تھی؟,7,What were you doing in the kitchen?,7,,
Band Baj Gaya,00:13:48.340,تم کچن میں کیا کرتی ہو؟,6,What do you do in the kitchen?,7,,
Band Baj Gaya,00:13:52.270,تم دونوں کچن میں کیا کر رہے تھے؟,8,What were you both doing in the kitchen?,8,,
Band Baj Gaya,00:13:58.980,جو ہم دونوں کرتے ہیں۔,5,What we both do.,4,,
Band Baj Gaya,00:14:03.580,ناشتہ بنانا۔,2,Making breakfast.,2,,
Band Baj Gaya,00:14:08.920,اوہ، میرے خدا، اوہ، میرے خدا!,6,"Oh, my God, oh, my God!",6,,
Band Baj Gaya,00:14:11.970,اب میں سمجھ گیا، آپ نے,6,"Now I get it, you moved",6,,
Band Baj Gaya,00:14:16.860,کیونکہ وہ رات کی شفٹ میں بھی کام کرتی ہے۔,10,because she works for night shift too.,7,,
Band Baj Gaya,00:14:19.180,تاکہ جب میں کام پر جاؤں تو,7,"So that when I go for work,",7,,
Band Baj Gaya,00:14:24.860,جیا؟,1,Jia?,1,,
Band Baj Gaya,00:14:27.540,فضول باتوں پر وقت ضائع کرنے کی ضرورت نہیں۔,9,No need to waste time on useless,7,,
Band Baj Gaya,00:14:32.840,تم جو کچھ کر سکتے ہو کرو، ٹھیک ہے؟,9,"Do whatever you can, okay?",5,,
Band Baj Gaya,00:14:37.170,ٹھیک ہے، ٹھیک ہے۔,4,"Okay, fine.",2,,
Band Baj Gaya,00:14:39.690,اگر آپ اس گھر کو چھوڑنا نہیں چاہتے ہیں،,9,"If you don't want to leave this house,",8,,
Band Baj Gaya,00:14:42.060,تو یہ خاندان,3,then this family is going to,6,,
Band Baj Gaya,00:14:47.390,اب میں اس مکان نمبر,5,Now I am going to divide this house number,9,,
Band Baj Gaya,00:14:56.710,اور آپ، آپ,3,"And you, you are going",5,,
Band Baj Gaya,00:14:59.830,اور,1,and they will have,4,,
Band Baj Gaya,00:15:02.760,یا تو آپ اسے قبول کریں یا نہ کریں،,9,"Either you accept it or not,",6,,
Band Baj Gaya,00:15:09.940,کیا تم لوگ اس کے ساتھ ٹھیک ہو؟,8,Are you guys okay with it?,6,,
Band Baj Gaya,00:15:11.760,-نہیں، ہم...,2,"-No, we...",2,,
Band Baj Gaya,00:15:20.090,ٹھیک ہے، ٹھیک ہے، پھر میں,6,"Okay, fine, then I'm going to take",7,,
