Drama Name,Timestamp,Urdu Subtitle,Urdu Length,English Subtitle,English Length,Episode,Genre
Umm-e-Haniya,00:31:04.120,دیکھو,1,"Look,",1,,
Umm-e-Haniya,00:31:05.600,میں نے اپنی اور ہانیہ کی تصویر کامل کو بھیجی،,10,"I sent a picture of me and Hania to Kamil,",10,,
Umm-e-Haniya,00:31:08.400,وہ بہت خوش ہوا۔,4,he was very happy.,4,,
Umm-e-Haniya,00:31:11.360,ماشاءاللہ آپ دونوں خوبصورت لگ رہے ہیں۔,7,"MashaAllah, both of you look beautiful.",6,,
Umm-e-Haniya,00:31:14.920,جی ہاں,2,Yes.,1,,
Umm-e-Haniya,00:31:15.800,ٹھیک ہے مجھے کچھ بتاؤ,5,"Okay, tell me something,",4,,
Umm-e-Haniya,00:31:17.440,جب میں شادی کے بعد ہانیہ کو اپنے ساتھ لے جاؤں گی تو,13,"when I take Hania with me after wedding,",8,,
Umm-e-Haniya,00:31:20.120,تم مجھے زیادہ یاد کرو گے یا ہانیہ؟,8,will you miss me more or Hania?,7,,
Umm-e-Haniya,00:31:23.600,کیا وہ کچھ پوچھنا ہے؟,5,Is that something to ask?,5,,
Umm-e-Haniya,00:31:28.680,ہانیہ کے,2,It’s only been few says since Hania,7,,
Umm-e-Haniya,00:31:33.240,تم میری گڑیا ہو،,4,"You are my doll,",4,,
Umm-e-Haniya,00:31:35.360,میری جان،,2,"my life,",2,,
Umm-e-Haniya,00:31:36.880,آف کورس، میں تمہیں یاد کروں گا۔,7,"offcourse, I will miss you.",5,,
Umm-e-Haniya,00:31:40.560,خدا آپ کی قسمت ٹھیک کرے,6,May God make your fate well,6,,
Umm-e-Haniya,00:31:44.360,اور آپ کو ڈھیروں خوشیاں عطا کرے۔,7,and gives you loads of happiness.,6,,
Umm-e-Haniya,00:31:46.840,آمین۔,1,Amen.,1,,
Umm-e-Haniya,00:31:48.080,آمین۔,1,Amen.,1,,
Umm-e-Haniya,00:31:51.000,ٹھیک ہے رومی,3,"Okay Rumi,",2,,
Umm-e-Haniya,00:31:53.680,اب جب تک تم شادی نہیں کر لیتے,8,"now till you get married,",5,,
Umm-e-Haniya,00:31:57.720,بس ہانیہ سے فاصلہ رکھنے کی کوشش کرو۔,8,just try to keep your distance from Hania.,8,,
Umm-e-Haniya,00:32:02.480,کیوں؟,1,Why?,1,,
Umm-e-Haniya,00:32:05.080,میں اس لیے کہہ رہا ہوں کہ آپ کو بری نظر نہ لگے۔,13,I am saying so you don’t get evil eye.,9,,
Umm-e-Haniya,00:32:10.040,میں نے اور تمہارے پاپا نے پہلے ہی بہت برداشت کیا ہے،,12,"I and your dad have already tolerated so much,",9,,
Umm-e-Haniya,00:32:14.440,میں نہیں چاہتا کہ تمہاری خوشی کو بری نظر لگے۔,10,I don’t want your happiness to get evil eye.,9,,
Umm-e-Haniya,00:32:20.080,لوگ اور ان کی بُری نظر،,6,"People and their evil eyes,",5,,
Umm-e-Haniya,00:32:22.520,انسان اپنی خوشی بھی آزادی سے نہیں منا سکتا۔,9,a person cannot even celebrate their,6,,
Umm-e-Haniya,00:32:25.920,میں آپ سے کہتا ہوں کہ احتیاط کریں، اس میں کیا حرج ہے؟,13,"I am asking you to be careful, what’s wrong in it?",11,,
Umm-e-Haniya,00:32:28.760,اے خدا!  پریشان نہ ہوں، سب کچھ,7,"Oh God! Don’t worry, everything will",6,,
Umm-e-Haniya,00:32:35.040,انشاءاللہ۔,1,InshaAllah.,1,,
Umm-e-Haniya,00:32:36.320,اب جلدی سے دودھ ختم کریں۔,6,Now quickly finish the milk.,5,,
Umm-e-Haniya,00:32:38.640,ٹھیک ہے۔,2,Okay.,1,,
Umm-e-Haniya,00:32:49.040,جی نعیم،,2,"Yes Naeem,",2,,
Umm-e-Haniya,00:32:50.280,نارتھ سٹار کے اس اقتباس کا کیا ہوگا,8,what about the quotation from North Star,7,,
Umm-e-Haniya,00:32:53.280,میری کل ملاقات ہے۔,4,I have a meeting tomorrow.,5,,
Umm-e-Haniya,00:32:56.080,ہاں,1,"Yes,",1,,
Umm-e-Haniya,00:32:57.560,ابھی مجھے بھیج دو۔  ٹھیک ہے۔  اندر,7,send it to me right now. Okay.,7,,
Umm-e-Haniya,00:33:04.240,آجاؤ۔,1,Come in.,2,,
Umm-e-Haniya,00:33:07.200,ہیلو ماہم,2,"Hello Maham,",2,,
Umm-e-Haniya,00:33:09.600,مجھے امید ہے کہ آج تمہارا موڈ بہتر ہو گا۔,10,I hope your mood will be better today.,8,,
Umm-e-Haniya,00:33:13.360,یہاں پریزنٹیشن ہے۔,3,Here is the presentation.,4,,
Umm-e-Haniya,00:33:14.480,بہتر ہے کہ آپ میرا موڈ جاننے کی کوشش نہ کریں,11,its better if you don’t try to find out,9,,
Umm-e-Haniya,00:33:17.320,اور میں آپ کا باس ہوں،,6,"and I am your boss,",5,,
Umm-e-Haniya,00:33:18.440,یہاں سب مجھے میڈم کہتے ہیں،,6,"everyone calls me ma’am here,",5,,
Umm-e-Haniya,00:33:19.960,میں اگلی بار آپ سے اپنا نام نہیں سننا چاہتا۔,10,I don’t want to hear my name from,8,,
Umm-e-Haniya,00:33:22.880,اوکے میڈم،,2,"Okay ma’am,",2,,
Umm-e-Haniya,00:33:25.560,جیسا آپ کی مرضی ماہم۔,5,as you wish Maham.,4,,
Umm-e-Haniya,00:33:28.760,تمہاری ہمت کیسے ہوئی؟,4,How dare you?,3,,
Umm-e-Haniya,00:33:30.400,آپ اپنے آپ کو کیا سمجھتے ہیں؟  ایسا,8,What do you think of yourself?,6,,
Umm-e-Haniya,00:33:32.560,انسان جسے آپ کبھی نہیں سمجھ سکتے۔  باہر,8,A human being that you can never,7,,
Umm-e-Haniya,00:33:37.040,نکلو!  باہر,2,Get out!,2,,
Umm-e-Haniya,00:33:38.400,نکلو!,1,Get out!,2,,
Umm-e-Haniya,00:34:04.360,بالکل،,1,"Exactly,",1,,
Umm-e-Haniya,00:34:05.640,میں ان غلطیوں کو نہیں دہرانا چاہتا جو,8,I don’t want to repeat the mistakes,7,,
Umm-e-Haniya,00:34:09.480,کیونکہ اگر ہم,3,because if we don’t respect our,6,,
Umm-e-Haniya,00:34:13.280,اس کا اثر ہمارے دفتر، ملازمین,6,"it will affect our office, employees",6,,
Umm-e-Haniya,00:34:17.520,جی,1,"Yeah,",1,,
Umm-e-Haniya,00:34:18.760,میں آپ سے 100% متفق ہوں۔,6,I 100% agree with you.,5,,
Umm-e-Haniya,00:34:21.760,لیکن یہاں یہ سمجھنا بہت ضروری ہے,7,But it is very important to understand here,8,,
Umm-e-Haniya,00:34:24.360,کہ ہم,2,that we take decisions according to,6,,
Umm-e-Haniya,00:34:26.760,نہ کہ اپنی ذاتی انا کے لیے۔,7,and not for our personal ego.,6,,
Umm-e-Haniya,00:34:29.680,میری بات بالکل یہی ہے،,5,"Exactly that’s what my point is,",6,,
Umm-e-Haniya,00:34:32.720,اسی لیے میں نے اب فیصلہ کیا ہے کہ,9,that’s why I have now decided that,7,,
Umm-e-Haniya,00:34:35.520,ایگزیکٹو لیول کے تمام فیصلے,5,all the decision of the executive level will,8,,
Umm-e-Haniya,00:34:40.080,جہاں تک محکمہ خزانہ کا تعلق ہے,7,"As far as finance department is concerned,",7,,
Umm-e-Haniya,00:34:44.360,کوئی شک، کسی کو؟,4,"Any doubts, anyone?",3,,
Umm-e-Haniya,00:34:48.200,ٹھیک ہے، مجھے لگتا ہے کہ سب کچھ حل ہو گیا ہے,12,"Okay, I think everything has been sorted out",8,,
Umm-e-Haniya,00:34:53.120,ماہم، ہماری,2,"Maham, we have a meeting with",6,,
Umm-e-Haniya,00:34:56.480,اگر ہم ان کے ساتھ جوائنٹ وینچر کرنے کے قابل ہو گئے تو,13,"if we are able to have a joint venture with them,",11,,
Umm-e-Haniya,00:35:01.080,کیا آپ اس میٹنگ کے لیے تیار ہیں؟,8,are you ready for that meeting?,6,,
Umm-e-Haniya,00:35:02.680,بالکل!  میں تیار ہوں۔,4,Absolutely! I am ready.,4,,
Umm-e-Haniya,00:35:05.000,ٹھیک ہے، شکریہ۔,3,"Fine,thank you.",2,,
Umm-e-Haniya,00:35:06.560,ٹھیک ہے، شکریہ۔,3,"Okay, thank you.",3,,
Umm-e-Haniya,00:35:13.200,روحان,1,"Rohan,",1,,
Umm-e-Haniya,00:35:14.480,تمہیں اپنے فیصلے پر نظر ثانی کرنی چاہیے,8,you should reconsider your decision,5,,
Umm-e-Haniya,00:35:19.440,کیونکہ تمہارے جانے کے بعد,5,"because after you leave, it will be",7,,
Umm-e-Haniya,00:35:25.000,امتیاز صاحب، میرا فیصلہ حتمی ہے,6,"Mr. Imtiaz, my decision is final",6,,
Umm-e-Haniya,00:35:27.040,اور مجھے لگتا ہے کہ ماہم یہ سب سنبھال سکتی ہیں،,11,"and I think Maham can handle all this,",8,,
Umm-e-Haniya,00:35:30.520,اسے بس تھوڑی سی رہنمائی اور,6,She just needs a bit guidance and,7,,
Umm-e-Haniya,00:35:34.440,اور اگر پھر بھی کوئی مسئلہ ہوا تو,8,"and if there is still any problem,",7,,
Umm-e-Haniya,00:35:37.800,بالکل ٹھیک۔,2,Absolutely fine.,2,,
Umm-e-Haniya,00:35:47.520,ہاں، میڈم، آپ نے مجھے بلایا؟,6,"Yes, ma’am, you called me?",5,,
Umm-e-Haniya,00:35:49.920,جی ہاں,2,Yes.,1,,
Umm-e-Haniya,00:35:51.760,آپ نے نارتھ اسٹار کی درخواست کے بارے میں کیا کیا؟,11,what did you do about the North star’s petition?,9,,
Umm-e-Haniya,00:35:54.960,شام ہونے کو ہے، کب,5,"It’s almost evening, when will",5,,
Umm-e-Haniya,00:35:58.320,میڈم، وہ…,2,"Ma’am, that…",2,,
Umm-e-Haniya,00:35:59.720,یہ کیا اور وہ؟,4,What this and that?,4,,
Umm-e-Haniya,00:36:01.160,مجھے ابھی اس کی ضرورت ہے، میں,7,"I need it right now, I even want",8,,
Umm-e-Haniya,00:36:04.640,محترمہ انجم صاحب اس پر کام کر رہے ہیں، کیا,10,"Ma’am, Mr. Anjum is working on it,",7,,
Umm-e-Haniya,00:36:08.280,انہوں نے آپ کے حوالے نہیں کیا؟,7,didn’t he hand it over to you?,7,,
Umm-e-Haniya,00:36:10.200,کیا؟,1,What?,1,,
Umm-e-Haniya,00:36:11.960,وہ بیوقوف اس پر کام کر رہا تھا؟,8,That idiot was working on it?,6,,
Umm-e-Haniya,00:36:17.880,اسے بلاؤ۔,2,Call him.,2,,
Umm-e-Haniya,00:36:20.560,میڈم، وہ رخصت لے کر,5,"Ma’am, he took an off",5,,
Umm-e-Haniya,00:36:24.760,چلا گیا کیونکہ یہ اس کے بھائی کی شادی ہے،,10,"and left as it is his brother’s wedding,",8,,
Umm-e-Haniya,00:36:26.920,میرا اندازہ ہے کہ وہ کل بھی نہیں آئے گا۔,10,I guess he wouldn’t even come tomorrow.,7,,
Umm-e-Haniya,00:36:28.960,کیا؟,1,What?,1,,
Umm-e-Haniya,00:36:30.680,یہ تم مجھے اب بتا رہے ہو؟,7,You are telling this to me now?,7,,
Umm-e-Haniya,00:36:39.680,تم بہت اچھی لگ رہی ہو،,6,"You look very nice,",4,,
Umm-e-Haniya,00:36:41.800,میں نے,2,I have seen you dressed up like,7,,
Umm-e-Haniya,00:36:46.040,یہ صرف ماں کا دکھاوا ہے،,6,"This is just a show off mom,",7,,
Umm-e-Haniya,00:36:48.400,اپنے غم کو چھپانے کے لیے اور,7,to cover up my own grief and,7,,
Umm-e-Haniya,00:36:52.480,کہاں جا رہے ہو؟,4,Where are you going?,4,,
Umm-e-Haniya,00:36:54.600,یہ رومی کی مہندی ہے،,5,"It’s Rumi’s henna,",3,,
Umm-e-Haniya,00:36:56.400,ابھی میرا ایک اچھا دوست رہ گیا ہے،,8,"I just have one good friend left now,",8,,
Umm-e-Haniya,00:36:59.000,اگر میں اس کی خوشی میں شریک نہ ہوا تو,10,"if I wouldn’t participate in her happiness,",7,,
Umm-e-Haniya,00:37:01.840,وہ ہمیشہ کے لیے پریشان ہو جائے گی۔,8,she will get upset forever.,5,,
Umm-e-Haniya,00:37:03.880,نہیں، آپ کو ضرور جانا چاہیے،,6,"No, you must go,",4,,
Umm-e-Haniya,00:37:06.040,آپ کو ضرور دوسروں کی خوشی کا حصہ بننا چاہیے۔,10,you must definitely be a part of,7,,
Umm-e-Haniya,00:37:08.200,آپ بھی ساتھ چلیں ماں۔,5,"You come along too, mom.",5,,
Umm-e-Haniya,00:37:09.680,اتنا عرصہ ہو گیا آپ نے,6,It has been so long you didn’t,7,,
Umm-e-Haniya,00:37:12.960,نہیں، میں وہاں کیا کروں گا؟  آپ کو جانا چاہیے۔,10,"No, what will I do there? You must go.",9,,
Umm-e-Haniya,00:37:15.720,ماں آپ کہتی تھیں کہ,5,"Mom, you used to say that",6,,
Umm-e-Haniya,00:37:17.480,گھر میں رہنے سے آدمی بیمار ہو جاتا ہے۔,9,a person gets sick staying at home.,7,,
Umm-e-Haniya,00:37:20.360,آپ ساتھ آئیں گے تو اچھا لگے گا,8,You will feel nice if you come along,8,,
Umm-e-Haniya,00:37:22.560,اور پھر رومی نے بھی آپ کو دعوت دی ہے۔,10,and then Rumi has even invited you.,7,,
Umm-e-Haniya,00:37:26.880,ٹھیک ہے اگر آپ کہیں۔,5,Okay if you say so.,5,,
Umm-e-Haniya,00:37:30.920,ٹھہرو، میں تیار ہو جاتی ہوں۔,6,"Wait, I’ll get ready.",4,,
Umm-e-Haniya,00:37:44.480,اس نے جان بوجھ کر اپنا فون بند کر دیا ہے۔,11,He has switched his phone off on purpose.,8,,
Umm-e-Haniya,00:37:46.360,لعنت ہو!,2,Damn it!,2,,
Umm-e-Haniya,00:37:48.360,محترمہ ہم نے,3,Ma’am we didn’t assign any computer to,7,,
Umm-e-Haniya,00:37:54.720,پورے دفتر میں کیسے معلوم کریں,6,how should we find out in the entire office,9,,
Umm-e-Haniya,00:37:57.160,کہ وہ کس کمپیوٹر پر کام کر رہے ہیں؟,9,that what computer was he working on?,7,,
Umm-e-Haniya,00:37:58.920,اس کا فون بھی بند ہے،,6,"Even his phone is off,",5,,
Umm-e-Haniya,00:38:01.640,کیا آپ نے اس سے رابطہ کیا؟,7,did you get to contact him?,6,,
Umm-e-Haniya,00:38:04.080,اس کے ساتھ جہنم میں۔,5,To hell with him.,4,,
Umm-e-Haniya,00:38:05.560,جاؤ اور,2,Go and prepare the presentation,5,,
Umm-e-Haniya,00:38:09.480,کیا تم یہ کر سکتے ہو نعیم؟,7,"Can you do it, Naeem?",5,,
Umm-e-Haniya,00:38:11.920,میڈم، میں؟,2,"Ma’am, I?",2,,
Umm-e-Haniya,00:38:14.160,اتنی جلدی کیسے ہو سکتا ہے؟,6,How can it be done so soon?,7,,
Umm-e-Haniya,00:38:16.440,دیکھو,1,"Look,",1,,
Umm-e-Haniya,00:38:17.400,انجم احمد کو بھی,4,even Anjum Ahmed took,4,,
Umm-e-Haniya,00:38:21.040,تو اسے,2,So the he should have given it to,8,,
Umm-e-Haniya,00:38:23.400,یا,1,or,1,,
Umm-e-Haniya,00:38:24.440,اسے کم از کم مجھے ای میل کرنا چاہیے تھا،,10,"he should have atleast emailed me,",6,,
Umm-e-Haniya,00:38:26.600,میں کل میٹنگ میں کیا کروں گا؟,7,what will I do in the meeting tomorrow?,8,,
Umm-e-Haniya,00:38:29.640,ایک کام کرو، H.R کے پاس جاؤ اور اس کا ایڈریس,11,"Do one thing, go to the H.R and get his address",11,,
Umm-e-Haniya,00:38:32.160,یا کوئی ہنگامی رابطہ نمبر لے کر,7,or any emergency contact number,5,,
Umm-e-Haniya,00:38:35.400,مجھے آج اس پیشکش کی ضرورت ہے،,7,"I need this presentation today,",5,,
Umm-e-Haniya,00:38:38.400,اور سنو؟,2,And listen?,2,,
Umm-e-Haniya,00:38:39.960,جی ہاں؟,2,Yes?,1,,
Umm-e-Haniya,00:38:41.480,روحان کو اس کی خبر نہیں ہونی چاہیے۔,8,Rohan shouldn’t get to know of it.,7,,
Umm-e-Haniya,00:38:43.560,ٹھیک ہے۔,2,Okay.,1,,
Umm-e-Haniya,00:00:47.920,ماہم، کیا میں آپ کے لیے کھانا لاؤں؟,8,"Maham ma’am, shall I get food for you?",8,,
Umm-e-Haniya,00:00:50.560,نہیں، میرے پاس کھانا نہیں ہوگا،,6,"No, I won’t have food,",5,,
Umm-e-Haniya,00:00:52.160,میرے لیے کافی کا ایک مضبوط کپ بنا دو۔  کیا,10,make me a strong cup of coffee for me.,9,,
Umm-e-Haniya,00:00:56.600,ماں اپنے کمرے میں ہے؟,5,Is mom in her room?,5,,
Umm-e-Haniya,00:00:58.160,وہ روحان صاحب کے ساتھ باہر گئی ہوئی ہے۔,9,She has gone out with Rohan sir.,7,,
Umm-e-Haniya,00:01:01.480,ٹھیک ہے۔,2,Okay.,1,,
Umm-e-Haniya,00:01:06.480,ہاں نعیم کیا رپورٹ ہے؟,5,"Yes, Naeem, what is the report?",6,,
Umm-e-Haniya,00:01:08.880,میڈم انجم کا فون مسلسل بند رہتا ہے۔,8,"Madam, Anjum's phone is constantly off.",6,,
Umm-e-Haniya,00:01:11.920,میں جانتا ہوں، پتہ کا کیا ہوگا؟,7,"I know that, what about the address?",7,,
Umm-e-Haniya,00:01:14.800,میڈم مجھے ایڈریس مل گیا ہے،,6,"Madam, I have found the address,",6,,
Umm-e-Haniya,00:01:18.040,جب آپ اس سے ملیں تو مجھے فوراً کال کریں۔,10,Call me immediately when you meet him.,7,,
Umm-e-Haniya,00:01:19.880,ضرور میڈم، ضرور۔,3,"Sure ma’am, sure.",3,,
Umm-e-Haniya,00:01:31.280,روحان، آپ کو دیکھ کر بہت اچھا لگا۔,8,"Rohan, it’s so good to see you.",7,,
Umm-e-Haniya,00:01:34.800,چچا، یہ میری ماں ہے،,5,"Uncle, that’s my mom,",4,,
Umm-e-Haniya,00:01:37.400,شکریہ بیٹا۔  آؤ,3,"Thank you, son. Come.",4,,
Umm-e-Haniya,00:03:38.080,یہ ہے.  بس، رونا نہیں، بس۔,6,"That’s it. that’s it, don’t cry,",6,,
Umm-e-Haniya,00:03:46.840,سنڈاس۔,1,Sundas?,1,,
Umm-e-Haniya,00:03:49.280,یہاں آؤ۔,2,Come here.,2,,
Umm-e-Haniya,00:03:54.680,ہاں خالہ؟,2,Yes aunt?,2,,
Umm-e-Haniya,00:03:55.680,اس کا خیال رکھنا، میں,5,"Take care of her, I will go for",8,,
Umm-e-Haniya,00:03:58.400,اسے پکڑو۔,2,Hold her.,2,,
Umm-e-Haniya,00:04:00.640,یہ ہے، یہ ہے.,4,"That’s it, that’s it.",4,,
Umm-e-Haniya,00:04:05.480,یہ ہے.,2,That’s it.,2,,
Umm-e-Haniya,00:04:45.400,سنڈاس، مبارک ہو،,3,"Sundas, congratulations,",2,,
Umm-e-Haniya,00:04:48.240,یہ ایک لڑکی ہے اور یہ میری نہیں ہے۔,9,That’s a girl and its not mine.,7,,
Umm-e-Haniya,00:04:51.720,معذرت، میں نہیں جانتا تھا، برا نہ مانیں۔,8,"Sorry I didn’t know, don’t mind.",6,,
Umm-e-Haniya,00:04:53.840,یہ ٹھیک ہے۔,3,Its okay.,2,,
Umm-e-Haniya,00:04:56.160,اسد؟  یہاں آؤ۔,3,Asad? Come here.,3,,
Umm-e-Haniya,00:05:02.680,تم یہاں کیا کر رہے ہو؟,6,What are you doing here?,5,,
Umm-e-Haniya,00:05:06.240,آپ کے پاس ڈانس کافی ہے،,6,"You have dances enough,",4,,
Umm-e-Haniya,00:05:09.040,ارے؟,1,Hey?,1,,
Umm-e-Haniya,00:05:09.880,خالہ جا کر رومی کے ساتھ بیٹھ گئیں,8,Aunt went and sat with Rumi,6,,
Umm-e-Haniya,00:05:12.520,ٹھیک ہے، میری بات سنو۔,5,"Okay, listen to me.",4,,
Umm-e-Haniya,00:05:14.160,کہاں جا رہی ہو سنداس؟,5,Where are you going Sundas?,5,,
Umm-e-Haniya,00:05:18.600,او میرے بچے!,3,Oh my baby!,3,,
Umm-e-Haniya,00:05:43.520,بھائی,1,"Brother,",1,,
Umm-e-Haniya,00:05:44.920,ہانیہ کو میرے حوالے کر دو,6,"give Hania to me,",4,,
Umm-e-Haniya,00:05:47.280,کیا ہوا ہانیہ؟,3,What happened Hania?,3,,
Umm-e-Haniya,00:05:49.360,رومی؟,1,Rumi?,1,,
Umm-e-Haniya,00:05:50.480,اس کا کوئی مسئلہ نہیں ہے۔,6,Its not a problem.,4,,
Umm-e-Haniya,00:05:51.800,یہ ٹھیک ہے۔,3,Its okay.,2,,
Umm-e-Haniya,00:05:53.680,چلو وہاں چلتے ہیں۔,4,Let’s go there.,3,,
Umm-e-Haniya,00:05:55.200,رہنے دو، وہاں چلتے ہیں۔,5,"Let it be, let’s go there.",6,,
Umm-e-Haniya,00:05:56.640,ماں کیسی دکھتی ہے؟,4,How does mom look?,4,,
Umm-e-Haniya,00:06:08.440,کیا آپ نے سارا ڈرامہ دیکھا؟,6,Did you see all the drama?,6,,
Umm-e-Haniya,00:06:11.160,کیا ہوا ماں؟,3,"What happened, mom?",3,,
Umm-e-Haniya,00:06:13.080,سب لطف اندوز ہو رہے ہیں،,6,"Everyone is enjoying,",3,,
Umm-e-Haniya,00:06:14.520,میں رومی کی بات کر رہا ہوں۔,7,I am talking about Rumi.,5,,
Umm-e-Haniya,00:06:17.600,اسے,1,What was the need for her,6,,
Umm-e-Haniya,00:06:21.360,اس نے تمام مہمانوں کے سامنے ہماری توہین کی ہے۔,10,She has insulted us in front of all the guests.,10,,
Umm-e-Haniya,00:06:25.160,اسے یہاں بلاؤ اور اسے ہانیہ کو ایک طرف رکھنے کو کہو،,12,"Call her here and ask her to keep Hania aside,",10,,
Umm-e-Haniya,00:06:28.640,وہ اس کی ماں نہیں کہ,6,she is not her mother that,6,,
Umm-e-Haniya,00:06:31.520,اسے بلاؤ ورنہ میں یہاں ایک منظر بناؤں گا۔,9,Call her else I’ll make a scene here.,8,,
Umm-e-Haniya,00:06:34.560,ماں، براہ مہربانی آرام کرو!  مجھے اسے بلانے دو۔,9,"Mom, please relax! Let me call her.",7,,
Umm-e-Haniya,00:06:47.080,زویا؟,1,Zoya?,1,,
Umm-e-Haniya,00:06:57.400,ہاں بھائی۔  کیا میں آپ کی تصویر لوں؟,8,"Yes, brother? Shall I take your picture?",7,,
Umm-e-Haniya,00:06:59.480,تصویر کے ساتھ جہنم، رومی کو فوراً کال کریں,9,"To hell with the picture, call Rumi immediately",8,,
Umm-e-Haniya,00:07:03.080,اور ہانیہ کو اس سے لے کر,7,and take Hania from her and,6,,
Umm-e-Haniya,00:07:06.840,میں اسے کس کو دوں؟  خالہ نائلہ۔,7,Who should I give it to? Aunt Naila?,8,,
Umm-e-Haniya,00:07:09.240,کوئی بھی ہو، اسے فوراً کال کریں۔,7,"Anyone, just immediately call her.",5,,
Umm-e-Haniya,00:07:11.800,ٹھیک ہے، میں اسے بلا رہا ہوں۔,7,"okay, I am calling her.",5,,
Umm-e-Haniya,00:07:21.080,بھابھی ہانیہ کو میرے حوالے کر دو اور ڈانس کرو۔,10,"Sister in law, give Hania to me and go dance.",10,,
Umm-e-Haniya,00:07:24.800,نہیں، یہ ٹھیک ہے، وہ میرے ساتھ ہے۔,8,"No, its okay, she is with me.",7,,
Umm-e-Haniya,00:07:26.560,اسے مجھے دے دو۔,4,Give her to me.,4,,
Umm-e-Haniya,00:07:28.320,میں اس کا خیال رکھوں گا۔  جاؤ,7,I’ll take care of her. Go.,6,,
Umm-e-Haniya,00:07:31.880,ٹھیک ہے۔  شکریہ,3,Okay. Thank you.,3,,
Umm-e-Haniya,00:07:47.960,رومی تم کہاں چلے گئے؟,5,Where did you go Rumi?,5,,
Umm-e-Haniya,00:07:50.440,کیا کوئی اپنا مہندی کا فنکشن اس طرح چھوڑ دیتا ہے؟,11,Does someone leave their henna function like this?,8,,
Umm-e-Haniya,00:07:52.560,سوری ہانیہ بہت رو رہی تھی اس لیے میں اس کے پاس گئی۔,13,"Sorry, Hania was crying a lot so I went to her.",11,,
Umm-e-Haniya,00:07:57.160,رومی میں نے تم سے کہا تھا کہ ہانیہ کو سنبھالنے کے لیے فیملی موجود ہے,16,"Rumi, I told you that the family is there to take care",12,,
Umm-e-Haniya,00:08:01.520,تم اتنی بدتمیزی کیوں کر رہے ہو؟,7,Why are you being so rude?,6,,
Umm-e-Haniya,00:08:03.000,میں صرف 5 منٹ کے لیے گیا،,7,"I just went for 5 minutes,",6,,
Umm-e-Haniya,00:08:06.920,میں بدتمیز نہیں ہوں،,4,"I am not being rude,",5,,
Umm-e-Haniya,00:08:08.600,جب میں کچھ کہوں تو میری بات سنو۔,8,just listen to me when I have said something.,9,,
Umm-e-Haniya,00:08:18.480,ٹھیک ہے، میں معافی چاہتا ہوں، براہ کرم پریشان نہ ہوں،,11,"Okay, I am sorry, don’t be upset please,",8,,
Umm-e-Haniya,00:08:22.080,مجھے امید ہے کہ آپ سمجھ گئے ہوں گے۔,9,I hope you understand.,4,,
Umm-e-Haniya,00:08:25.320,ٹھیک ہے، پلیز معذرت۔,4,"Okay, please sorry.",3,,
Umm-e-Haniya,00:08:29.240,مہربانی کر کے مسکرا دیں۔,5,Please smile.,2,,
Umm-e-Haniya,00:08:40.760,ہاں نعیم؟,2,"Yes, Naeem?",2,,
Umm-e-Haniya,00:08:42.840,اپ ڈیٹس کیا ہیں؟,4,What are the updates?,4,,
Umm-e-Haniya,00:08:46.040,ہاں میڈم لیکن گھر کو تالا لگا ہوا ہے۔,9,Yes ma’am but the house is locked.,7,,
Umm-e-Haniya,00:08:49.080,اوہ ہو!  میں اس آدمی کو مار ڈالوں گا۔,9,Oh ho! I will kill this man.,7,,
Umm-e-Haniya,00:08:51.600,میں نے پڑوسیوں سے بھی پوچھا,6,I even asked the neighbors,5,,
Umm-e-Haniya,00:08:53.840,اور وہ بتا رہے ہیں کہ انجم کی فیملی,9,and they are telling me that Anjum’s family,8,,
Umm-e-Haniya,00:08:57.720,یہ دراصل اس کے بھائی کی مہندی ہے۔,8,Its actually his brother’s henna.,5,,
Umm-e-Haniya,00:09:01.480,میڈم اب ہم کیا کریں گے؟,6,"Madam, what will we do now?",6,,
Umm-e-Haniya,00:09:03.600,ہمارے پاس زیادہ وقت نہیں ہے، کل کی,8,"We don’t have much time, tomorrow",6,,
Umm-e-Haniya,00:09:08.040,یہ ہماری کمپنی کے امیج کے بارے میں ہے۔  اس,10,it is about our company’s image.,6,,
Umm-e-Haniya,00:09:10.400,وقت میرے لیے میری تصویر,5,"Right now, for me, my image is more",8,,
Umm-e-Haniya,00:09:13.560,روحان اور مسٹر امتیاز کو ایک اور,7,Rohan and Mr. Imtiaz will get another,7,,
Umm-e-Haniya,00:09:17.600,اپنے بھائی کی تقریب کا مقام معلوم کریں۔,8,find out the venue of his brother’s function.,8,,
Umm-e-Haniya,00:09:20.080,ٹھیک ہے میڈم آپ فکر نہ کریں۔,7,"Okay madam, don’t worry.",4,,
Umm-e-Haniya,00:09:21.800,میں تلاش کروں گا اور آپ کو بتاؤں گا۔,9,I’ll find out and let you know.,7,,
Umm-e-Haniya,00:09:29.440,میں صرف امید کرتا ہوں کہ فنکشن ہموار ہو جائے گا۔,11,I just hope that the function goes smooth.,8,,
Umm-e-Haniya,00:09:32.440,انشاءاللہ۔,1,InshaAllah.,1,,
Umm-e-Haniya,00:09:33.720,شگفتہ، سب ٹھیک تو ہے نا؟,6,"Shagufta, everything is fine right?",5,,
Umm-e-Haniya,00:09:37.720,ماشاءاللہ، رومی اور کامل,4,"MashaAllah, Rumi and Kamil makes",5,,
Umm-e-Haniya,00:09:42.840,سچ ہے,2,True that,2,,
Umm-e-Haniya,00:09:44.960,لیکن مجھے وہ پسند نہیں آیا جو رومی نے ابھی کیا۔,11,but I didn’t like what Rumi did right now.,9,,
Umm-e-Haniya,00:09:49.680,اس نے کیا کیا؟,4,What did she do?,4,,
Umm-e-Haniya,00:09:52.800,آپ مہمانوں میں مصروف ہیں، آپ کو کیا پتہ؟,9,"You are busy with guests, what will you know?",9,,
