Drama Name,Timestamp,Urdu Subtitle,Urdu Length,English Subtitle,English Length,Episode,Genre
Umm-e-Haniya,00:35:08.720,جب آپ لوگ امریکہ جا رہے تھے،,7,"when you guys were heading to America,",7,,
Umm-e-Haniya,00:35:13.000,کیا؟,1,What?,1,,
Umm-e-Haniya,00:35:16.920,آپ کیا کہنا چاہ رہے ہیں؟,6,What are you trying to say?,6,,
Umm-e-Haniya,00:35:19.480,مجھے لگتا ہے کہ آپ اتنے ذہین ہیں کہ,9,I guess you are intelligent enough to,7,,
Umm-e-Haniya,00:35:25.320,میرا حادثہ؟,2,My accident?,2,,
Umm-e-Haniya,00:35:28.760,]ماں؟,1,]Mom?,1,,
Umm-e-Haniya,00:35:30.280,تم جھوٹ بول رہے ہو۔,5,You are lying.,3,,
Umm-e-Haniya,00:35:31.680,پھر سوچئے کہ وہ,4,Then think about it that why is she so,9,,
Umm-e-Haniya,00:35:36.040,وہ اسے کیوں بند کرنا چاہتی ہے؟,7,Why does she want to get it closed?,8,,
Umm-e-Haniya,00:36:12.080,کیا سوچ رہے ہو میرے بچے؟,6,What are you thinking my child?,6,,
Umm-e-Haniya,00:36:16.120,کہ میری قسمت عجیب ہے،,5,"That my fate is strange,",5,,
Umm-e-Haniya,00:36:20.920,جب میں کرکٹ میں ناکام ہوا,6,when I got unsuccessful in cricket,6,,
Umm-e-Haniya,00:36:25.160,مجھے وہ معصوم بچہ ملا,5,I found that innocent baby,5,,
Umm-e-Haniya,00:36:28.200,اور اب وہ وہ نہیں رہا،,6,"and now that she is not her anymore,",8,,
Umm-e-Haniya,00:36:32.000,کرکٹ نے پھر میرے دروازے پر دستک دی۔,8,cricket came knocking on my door again.,7,,
Umm-e-Haniya,00:36:36.560,میں صرف یہ سوچتا ہوں کہ وہ,7,I just think that,4,,
Umm-e-Haniya,00:36:39.800,ننھی پری میری زندگی میں کیوں آئی؟,7,why did that little fairy came to my life?,9,,
Umm-e-Haniya,00:36:43.200,یہ سب خدا کے منصوبے ہیں، میرے بچے،,8,"That’s all God’s plans, my child,",6,,
Umm-e-Haniya,00:36:48.920,وہ انسان کو ان کے مقصد کے بارے میں یاد دلاتا رہتا ہے۔,13,he keeps on reminding human being,6,,
Umm-e-Haniya,00:36:56.640,اب دیکھو،,2,"Now look,",2,,
Umm-e-Haniya,00:36:58.320,تم نے اس بچے کے لیے اتنا کچھ برداشت کیا،,10,"you bear so much for that baby,",7,,
Umm-e-Haniya,00:37:03.160,سب سے لڑ کر,4,you fought with everyone and,5,,
Umm-e-Haniya,00:37:07.640,تمہیں اس نیکی کا صلہ ملنا تھا۔,7,you had to get rewarded for,6,,
Umm-e-Haniya,00:37:12.000,ذرا غور کریں کہ ننھے فرشتے کی دعائیں,8,Just consider that little angel’s prayers,6,,
Umm-e-Haniya,00:37:15.720,تمہارے پاپا ٹھیک کہتے ہیں رومی،,6,"Your dad is right Rumi,",5,,
Umm-e-Haniya,00:37:20.560,ابھی سوچنے میں وقت ضائع نہ کرو،,7,"don’t waste your time in thinking now,",7,,
Umm-e-Haniya,00:37:24.400,جانے کا فیصلہ کر لو۔,5,take your decision of going.,5,,
Umm-e-Haniya,00:37:29.600,ماں؟,1,Mom?,1,,
Umm-e-Haniya,00:37:32.240,تم یہ کہہ رہے ہو؟,5,You are saying this?,4,,
Umm-e-Haniya,00:37:35.000,ہاں، میں ہوں۔,3,"Yes, I am.",3,,
Umm-e-Haniya,00:37:38.880,مجھے لگتا ہے کہ,4,I guess,2,,
Umm-e-Haniya,00:37:41.160,تیرے نصیب میں کیا لکھا ہے,6,"this what is written in your fate,",7,,
Umm-e-Haniya,00:37:46.120,میں کون ہوتا ہوں اسے بدلنے والا؟,7,who am I to change it?,6,,
Umm-e-Haniya,00:37:53.200,اپنے کوچ کو کال کریں اور اسے بتائیں,8,Call your coach and tell him,6,,
Umm-e-Haniya,00:37:58.080,کہ آپ آ رہے ہیں۔,5,that you are coming.,4,,
Umm-e-Haniya,00:38:01.440,نائلہ کیا میں خواب دیکھ رہی ہوں؟,7,"Naila, am I dreaming?",4,,
Umm-e-Haniya,00:00:07.400,کیوں؟,1,Why?,1,,
Umm-e-Haniya,00:00:09.280,آپ کا کام اچھا تھا پھر آپ اسے کیوں چھوڑنا چاہتے ہیں؟,12,Your job was good then why do you want to leave it?,12,,
Umm-e-Haniya,00:00:13.520,میں تمہیں کیا بتاؤں؟,4,What should I tell you?,5,,
Umm-e-Haniya,00:00:16.880,اور انہوں نے گزشتہ دو سالوں سے میری تنخواہ میں سے ایک پیسہ بھی نہیں بڑھایا،,16,and they haven’t even increased a penny,7,,
Umm-e-Haniya,00:00:21.240,میں نے ابھی اپنی قسمت کہیں اور آزمانے کا فیصلہ کیا ہے۔,12,I have just decided to try my luck else where now.,11,,
Umm-e-Haniya,00:00:27.120,ہمم، کوئی بھی فیصلہ لینے سے پہلے اچھی طرح سوچ لیں۔,11,"Hmm, just think thoroughly before",5,,
Umm-e-Haniya,00:00:31.720,ہاں، سنداس؟  کیوں بلایا؟,4,"Yes, Sundas? Why did you call?",6,,
Umm-e-Haniya,00:00:38.360,کیا؟  دوبارہ؟,2,What? Again?,2,,
Umm-e-Haniya,00:00:40.760,کیا ہوا ماں؟  کیا رومی ٹھیک ہے؟,7,"What happened, mom? Is Rumi okay?",6,,
Umm-e-Haniya,00:00:43.400,سندس، میں تم سے بعد میں بات کروں گا۔,9,"Sundas, I will talk to you later.",7,,
Umm-e-Haniya,00:00:49.720,ماں آپ چپ کیوں ہیں؟,5,"Mom, why are you quiet?",5,,
Umm-e-Haniya,00:00:52.160,انہوں نے بچے کے والدین کو ڈھونڈ لیا تو,9,They did find the baby’s parents,6,,
Umm-e-Haniya,00:00:56.520,اوہ، تو آپ کو پہلے ہی معلوم تھا؟,8,"Oh, so you already knew?",5,,
Umm-e-Haniya,00:01:00.120,تم بیوقوف کوئی راز نہیں رکھ سکتے۔,7,You morons can’t keep a secret.,6,,
Umm-e-Haniya,00:01:09.040,ماں تم ہمیشہ زویا کو کیوں ڈانٹتی ہو؟,8,"Mom, why do you always scold Zoya?",7,,
Umm-e-Haniya,00:01:14.920,ان دنوں کوئی بھی کچھ چھپا نہیں سکتا۔,8,No one can hide anything these days.,7,,
Umm-e-Haniya,00:01:20.200,ماں، ذرا بتاؤ، سندرس کیا کہہ رہی تھی؟,8,"Mom, just tell me, what was Sundas saying?",8,,
Umm-e-Haniya,00:01:22.600,ورنہ میں خود اسد سے پوچھ لوں گا۔,8,Else I’ll ask Asad myself.,5,,
Umm-e-Haniya,00:01:24.200,آپ یہی کہیں گے,4,That’s what you will say,5,,
Umm-e-Haniya,00:01:26.320,کیونکہ آپ ابھی تک وہیں پھنسے ہوئے ہیں، تو,9,"because you are still stuck there,",6,,
Umm-e-Haniya,00:01:29.800,پھر سن لیں، آپ کا محبوب,6,"so then listen, your beloved is going",7,,
Umm-e-Haniya,00:01:39.880,کیا؟,1,What?,1,,
Umm-e-Haniya,00:01:41.040,سندر نے مجھے بتایا کہ,5,Sundas told me that,4,,
Umm-e-Haniya,00:01:46.920,Hmph!,1,Hmph!,1,,
Umm-e-Haniya,00:01:49.280,یہ بہت اچھا ہے کہ وہ ہماری جان چھوڑ کر چلی گئی,12,Its great that she leaves our lives,7,,
Umm-e-Haniya,00:02:00.040,نہیں جناب نوید،,3,"No, Mr. Naveed,",3,,
Umm-e-Haniya,00:02:02.640,ہمیں رومی کا شکریہ ادا کرنا چاہیے،,7,"we should thank Rumi,",4,,
Umm-e-Haniya,00:02:05.160,ان کی جیت ہمارے لیے اہم ہے،,7,"her victory is important for us,",6,,
Umm-e-Haniya,00:02:09.000,ہاں، انشاء اللہ، ہم جلد ہی ملیں گے۔  الوداع,9,"yes, inshaAllah, we will meet soon.",6,,
Umm-e-Haniya,00:02:14.720,سر نوید نے وہاں آپ کی تیاری شروع کر دی ہے،,11,"Sir Naveed has started preparing for you there,",8,,
Umm-e-Haniya,00:02:19.640,میں آج ہی آپ کا ٹکٹ بک کروا دیتا ہوں۔,10,let me book your ticket today.,6,,
Umm-e-Haniya,00:02:22.480,شازیہ پہلے ہی وہاں میرا انتظار کر رہی ہے۔,9,Shazia is already waiting for me there.,7,,
Umm-e-Haniya,00:02:25.240,رومی،,1,"Rumi,",1,,
Umm-e-Haniya,00:02:27.240,کیا تم نے کامل سے بات کی؟,7,did you speak to Kamil?,5,,
Umm-e-Haniya,00:02:30.520,مجھے دیر ہو رہی ہے ماں، میں سیر کے لیے جا رہا ہوں,13,"I am getting late, mom, I am going for a walk",11,,
Umm-e-Haniya,00:02:33.040,پھر مجھے ٹریننگ کے لیے بھی جانا ہے،,8,"then I also have to go for training,",8,,
Umm-e-Haniya,00:02:35.040,فکر نہ کرو بس بچے کا خیال رکھنا۔,8,don’t worry just take care of the baby.,8,,
Umm-e-Haniya,00:02:46.440,مجھے بہت افسوس ہے،,4,"I am so sorry,",4,,
Umm-e-Haniya,00:02:49.000,میں بالکل بھول گیا تھا کہ وہ اب اس کے گھر میں نہیں ہے۔,14,I completely forgot she is not in his house anymore.,10,,
Umm-e-Haniya,00:02:53.600,کم از کم جوس پی لیں۔  کامل کے بارے میں اب,11,Atleast have the juice.,4,,
Umm-e-Haniya,00:02:58.720,بات کرنے کا کوئی فائدہ نہیں,6,There is no point of discussing,6,,
Umm-e-Haniya,00:03:48.920,یہ کس کا بچہ ہے؟,5,Whose baby is it?,4,,
Umm-e-Haniya,00:03:50.760,کیا عجیب لوگ ہیں یہ,5,"What sort of strange people are they,",7,,
Umm-e-Haniya,00:03:54.000,خدا جانے وہ کب سے رو رہی ہے۔,8,God know since when he has been crying.,8,,
Umm-e-Haniya,00:03:57.320,ہیلو؟  کوئی ہے؟,3,Hello? Is anyone there?,4,,
Umm-e-Haniya,00:04:14.400,کیا کوڑا؟  کیا,3,What rubbish?,2,,
Umm-e-Haniya,00:04:17.040,آپ اپنے حواس میں ہیں؟,5,Are you in your senses?,5,,
Umm-e-Haniya,00:04:18.920,تم مجھ پر الزام لگا رہے ہو، تمہاری ماں؟,9,"You are blaming me, your mother?",6,,
Umm-e-Haniya,00:04:21.960,اپنے بچوں کے لیے یہ کام صرف ایک ماں ہی کر سکتی ہے،,13,"Only a mother can do this for their children,",9,,
Umm-e-Haniya,00:04:25.720,کیونکہ تم مجھے ہر قیمت پر گھر چاہتی تھی،,9,"because you wanted me home at any cost,",8,,
Umm-e-Haniya,00:04:29.560,تم صبا سے نفرت کرتے تھے،,6,"you hated Saba,",3,,
Umm-e-Haniya,00:04:31.840,اسی لیے تم نے یہ ساری سازش کی۔,8,that’s why you did all this conspiracy.,7,,
Umm-e-Haniya,00:04:34.000,یہ سب جھوٹ ہے!,4,This is all a lie!,5,,
Umm-e-Haniya,00:04:36.440,میں نے آپ کے خلاف کوئی سازش نہیں کی،,9,"I haven’t done any conspiracy against you,",7,,
Umm-e-Haniya,00:04:39.360,آپ جھوٹ بول رہے ہیں۔,5,you are lying.,3,,
Umm-e-Haniya,00:04:41.240,تم نے ایسا کیوں کیا ماں؟,6,Why did you do this mom?,6,,
Umm-e-Haniya,00:04:44.520,تم نے اپنی ضد پر میری جان بھی خطرے میں ڈال دی؟,12,You even risked my life for your stubbornness?,8,,
Umm-e-Haniya,00:04:50.160,تم نے صبا کو مجھ سے چھین لیا،,8,"You took away Saba from me,",6,,
Umm-e-Haniya,00:04:54.040,تم یہ کیسے کر سکتے ہو؟,6,how can you do this?,5,,
Umm-e-Haniya,00:04:56.200,تمہیں شرم آنی چاہیے۔,4,You should be ashamed.,4,,
Umm-e-Haniya,00:04:59.800,میں تمہاری جان کو خطرے میں ڈالوں گا؟,8,I will risk your life?,5,,
Umm-e-Haniya,00:05:03.080,تم یہ سوچ بھی کیسے سکتے ہو؟,7,How can you even think that?,6,,
Umm-e-Haniya,00:05:07.920,ہاں میں اپنے بچے کے لیے کچھ بھی کر سکتا ہوں,11,Yes I can do anything for my child,8,,
Umm-e-Haniya,00:05:11.880,لیکن میں آپ کی جان کو کبھی خطرے میں نہیں ڈال سکتا،,12,"but I can never put your life in danger,",9,,
Umm-e-Haniya,00:05:16.720,آپ کا حادثہ محض ایک حادثہ تھا۔,7,your accident was just an accident.,6,,
Umm-e-Haniya,00:05:21.760,مقدمہ کیوں بند کروایا؟,4,Why did you get the case filed closed?,8,,
Umm-e-Haniya,00:05:24.560,آپ کیا چھپانا چاہتے تھے؟,5,What did you want to hide?,6,,
Umm-e-Haniya,00:05:29.680,اب تم چپ کیوں ہو گئی ماں؟,7,"Why did you go quiet now, mom?",7,,
Umm-e-Haniya,00:05:32.880,جواب دو؟,2,Answer me?,2,,
Umm-e-Haniya,00:05:35.520,تم کیا چھپا رہے تھے؟,5,What were you hiding?,4,,
Umm-e-Haniya,00:06:37.040,رومی؟,1,Rumi?,1,,
Umm-e-Haniya,00:06:39.240,رومی پلیز میری بات سنو۔,5,Rumi please listen to me.,5,,
Umm-e-Haniya,00:06:40.760,میرا ہاتھ چھوڑو!,3,Leave my hand!,3,,
Umm-e-Haniya,00:06:42.080,رومی، میں تمہاری نظروں میں اتنا گرا ہوں کہ,9,"Rumi, I have fallen so much in your sight that",10,,
Umm-e-Haniya,00:06:47.880,رومی، ہماری محبت کی خاطر!,5,"Rumi, for the sake of our love!",7,,
Umm-e-Haniya,00:06:52.440,تم ٹھیک تھے رومی،,4,"You were fine, Rumi,",4,,
Umm-e-Haniya,00:06:55.640,تم سب کے دباؤ کی وجہ سے بچہ کسی کو دے سکتے تھے,13,you could have given the baby to someone,8,,
Umm-e-Haniya,00:06:59.000,اور وہ کبھی اپنے والدین کے پاس نہ پہنچتی،,9,"and she would have never gotten to her parents,",9,,
Umm-e-Haniya,00:07:03.200,اسی لیے مجھے تم پر فخر ہے۔,7,that’s why I am proud of you.,7,,
Umm-e-Haniya,00:07:08.320,تم میرا فخر تھے.,4,you were my pride.,4,,
Umm-e-Haniya,00:07:15.000,رومی، پلیز مجھے غلط مت سمجھو،,6,"Rumi, please don’t misunderstand me,",5,,
Umm-e-Haniya,00:07:18.560,انسان غلطیاں کرتا ہے،,4,"human make mistakes,",3,,
Umm-e-Haniya,00:07:21.120,مجھے معاف کر دو، رومی۔,5,"forgive me, Rumi.",3,,
Umm-e-Haniya,00:07:24.840,کاش یہ ممکن ہوتا لیکن اب بہت دیر ہو چکی ہے۔,11,I wish that was possible but its too late now.,10,,
Umm-e-Haniya,00:07:28.840,میں نے دوبارہ کرکٹ کھیلنے کا فیصلہ کیا ہے اور,10,I have decided to play cricket again and,8,,
Umm-e-Haniya,00:07:33.040,میں جانتا ہوں,3,I know.,2,,
Umm-e-Haniya,00:07:35.400,تو میرا اندازہ ہے کہ آپ مجھے روکنے کے لیے یہاں ہیں، ہاں؟,13,"So I guess you are here to stop me, yeah?",10,,
Umm-e-Haniya,00:07:37.600,آپ کو روکنے کے لیے نہیں,6,Not to stop you,4,,
Umm-e-Haniya,00:07:40.280,بلکہ ایک اور موقع مانگنے کے لیے۔,7,but to ask for another chance.,6,,
Umm-e-Haniya,00:07:44.000,رومی، تم شادی کے بعد بھی کیمپ میں جا سکتی ہو،,11,"Rumi, you can even join the camp after marriage,",9,,
Umm-e-Haniya,00:07:47.800,اور بچے کا معاملہ پہلے ہی حل ہو چکا ہے۔,10,and the baby matter has already been sorted.,8,,
Umm-e-Haniya,00:07:50.560,یہ ناممکن ہے،,3,"its impossible,",2,,
Umm-e-Haniya,00:07:52.720,میرا اندازہ ہے کہ معصوم بچہ میری زندگی میں آیا,10,I guess that innocent baby came in to my life,10,,
Umm-e-Haniya,00:07:56.000,تاکہ وہ ہمارے رشتے کو جانچ سکے۔,7,so that she can test our relationship.,7,,
Umm-e-Haniya,00:07:59.560,اور میں ایک بار آپ کے لیے اپنا کیریئر قربان کر چکا ہوں،,13,"And I have already sacrificed my career for you once,",10,,
Umm-e-Haniya,00:08:05.080,لیکن دوسری بار، میں یہ غلطی نہیں دہراؤں گا۔,9,"but second time, I won’t repeat this mistake.",8,,
Umm-e-Haniya,00:08:08.600,رومی، پلیز ایسا مت کرو،,5,"Rumi, please don’t do this,",5,,
Umm-e-Haniya,00:08:10.960,میں تمہارے بغیر نہیں رہ سکتا۔,6,I cannot live without you.,5,,
Umm-e-Haniya,00:08:16.400,رومی پلیز۔,2,Please Rumi.,2,,
Umm-e-Haniya,00:08:26.520,میں کچھ چھپانے کی کوشش نہیں کر رہا،,8,"I am not trying to hide anything,",7,,
Umm-e-Haniya,00:08:28.880,اگر آپ چاہیں تو کیس فائل کو دوبارہ کھول سکتے ہیں،,11,"you can get the case file reopened if you want to,",11,,
Umm-e-Haniya,00:08:34.520,آپ کو پتہ چل جائے گا کہ کیا سچ ہے,10,you will get to know what’s true,7,,
Umm-e-Haniya,00:08:36.880,اور کیا نہیں لیکن میں آپ کی جان کی قسم کھا کر کہتا ہوں,14,and what’s not but I swear upon your life,9,,
Umm-e-Haniya,00:08:40.920,کہ میں صبا کی موت کا ذمہ دار نہیں ہوں۔,10,that I am not responsible for Saba’s death.,8,,
Umm-e-Haniya,00:09:37.040,ہیلو؟,1,Hello?,1,,
Umm-e-Haniya,00:09:39.120,ہیلو رومی.,2,Hi Rumi.,2,,
Umm-e-Haniya,00:09:40.320,کیا میں نے آپ کو پریشان کیا؟,7,Did I disturb you?,4,,
Umm-e-Haniya,00:09:43.560,تم بتاؤ؟  کیا,3,you tell?,2,,
Umm-e-Haniya,00:09:44.960,آپ ابھی مجھ سے مل سکتے ہیں؟,7,Can you meet me right now?,6,,
Umm-e-Haniya,00:09:47.760,ٹھیک ہے، تم کہاں ہو؟,5,"Okay, where are you?",4,,
Umm-e-Haniya,00:09:59.880,مقدمہ کیوں بند کروایا؟,4,Why did you get the case filed closed?,8,,
Umm-e-Haniya,00:10:03.960,آپ کیا چھپانا چاہتے تھے؟,5,What did you want to hide?,6,,
Umm-e-Haniya,00:10:07.720,تم کیا چھپا رہے تھے؟,5,What were you hiding?,4,,
Umm-e-Haniya,00:10:16.320,میمونہ کہہ رہی تھی تم نے,6,Maimuna was telling you didn’t eat,6,,
Umm-e-Haniya,00:10:22.240,غم تمہاری بھوک کو کھا جاتا ہے۔,7,Grief eats your hunger.,4,,
Umm-e-Haniya,00:10:28.240,ظاہر ہے!,2,Obviously!,1,,
Umm-e-Haniya,00:10:29.680,جس بیٹے سے آپ کو بہت سی امیدیں ہیں اور,10,The son you have so many hopes in and,9,,
Umm-e-Haniya,00:10:33.840,یہ بہت افسوسناک ہے۔,4,it is very sad.,4,,
Umm-e-Haniya,00:10:35.880,میں تم سے کہتا تھا,5,I used to tell you,5,,
Umm-e-Haniya,00:10:38.000,کہ روحان کا دماغ خراب ہو گیا ہے،,8,"that Rohan has lost his mind,",6,,
Umm-e-Haniya,00:10:40.200,وہ اب کبھی,3,he will never take any decision,6,,
Umm-e-Haniya,00:10:42.520,لیکن تم مجھے سمجھ نہیں رہے،,6,"but you don’t understand me,",5,,
Umm-e-Haniya,00:10:44.480,اب دیکھو وہ تم پر صبا کے قتل کا الزام لگا رہا ہے،,13,"now see that he is accusing you for Saba’s murder,",10,,
Umm-e-Haniya,00:10:48.720,آئندہ وہ یہ بھی کہہ سکتا ہے کہ اس کی بیٹی,11,in future he can even say that his daughter,9,,
Umm-e-Haniya,00:10:52.960,نہیں،,1,"No,",1,,
Umm-e-Haniya,00:10:54.760,مجھے یقین ہے کہ اسے,5,I am sure that he has had,7,,
Umm-e-Haniya,00:10:56.960,میں اپنے بیٹے کو جانتا ہوں، مجھ سے بہت پیار کرتا ہے۔,12,"I know my son, loves me a lot.",8,,
Umm-e-Haniya,00:10:59.480,وہ نہیں لیکن آپ کو,5,He doesn’t but you definitely have,6,,
Umm-e-Haniya,00:11:01.880,وہ پہلے بھی صبا کی محبت میں دیوانہ تھا,9,he was crazy in love with Saba,7,,
Umm-e-Haniya,00:11:05.760,ابھی بھی وقت ہے ماں,5,"There is still time mom,",5,,
Umm-e-Haniya,00:11:08.560,اسے یہاں سے دور کر دو،,6,"send him away from here,",5,,
Umm-e-Haniya,00:11:10.560,مجھے ڈر ہے کہ وہ ہمیں زیادہ نقصان پہنچا دے گا۔,11,I am afraid he might cause a bigger damage to us.,11,,
Umm-e-Haniya,00:11:23.440,یہ ایک اچھی خبر ہے رومی، مبارک ہو،,8,"That’s a good news Rumi, congrats,",6,,
Umm-e-Haniya,00:11:25.880,مجھے لگتا ہے کہ آپ کو اس بچے کی مدد کرنے کا انعام ملا ہے۔,15,I think you got the reward for helping that baby.,10,,
Umm-e-Haniya,00:11:29.720,ابا بھی یہی کہتے ہیں،,5,"Even dad say the same,",5,,
Umm-e-Haniya,00:11:32.160,لیکن میں اسے بہت یاد کرتا ہوں،,7,"but I miss her a lot,",6,,
Umm-e-Haniya,00:11:34.000,کاش وہ ایک دن مزید ٹھہر پاتی۔,7,I wish she could have stayed for a day more.,10,,
Umm-e-Haniya,00:11:38.120,میں اب، یہ ہونا ہی تھا،,6,"I now, this was supposed to happen,",7,,
Umm-e-Haniya,00:11:40.640,میرا مطلب ہے کہ بچہ,5,I mean that baby was with you,7,,
Umm-e-Haniya,00:11:45.320,لیکن تم اتنے پریشان کیوں ہو؟,6,But why are you so upset?,6,,
Umm-e-Haniya,00:11:47.960,نہیں، میں نہیں ہوں۔,4,"No, I am not.",4,,
Umm-e-Haniya,00:11:51.520,میں سمجھ سکتا ہوں، آپ صبا کو یاد کرتی ہیں، ٹھیک ہے؟,12,"I can understand, you miss Saba, right?",7,,
Umm-e-Haniya,00:11:56.680,یہ زندگی ہے، روہن، کم سے,6,"This is life, Rohan,",4,,
Umm-e-Haniya,00:11:59.040,کم توقع، ہوتا ہے،,4,"the least expected, happens,",4,,
Umm-e-Haniya,00:12:02.360,لیکن آپ کو اب آگے بڑھنا چاہیے اور,8,but you should move on and,6,,
Umm-e-Haniya,00:12:06.880,محبت کو اتنی آسانی سے بھلایا نہیں جا سکتا رومی۔,10,"The love cannot be forgotten so easily, Rumi.",8,,
Umm-e-Haniya,00:12:11.000,تو آپ کا کہنا ہے کہ میں,7,So you mean to say that I am prioritizing,9,,
Umm-e-Haniya,00:12:15.120,نہیں، ایسا نہیں ہے،,4,"No, its not that,",4,,
Umm-e-Haniya,00:12:16.880,میں واقعی چاہتا ہوں کہ آپ,6,I really want you to become,6,,
Umm-e-Haniya,00:12:19.760,آپ ایسا بھی کر سکتے ہیں کیونکہ,7,You can even do that because,6,,
Umm-e-Haniya,00:12:24.600,لیکن مجھے نہیں معلوم کہ,5,but I don’t know if what,6,,
Umm-e-Haniya,00:12:28.000,صرف آپ کا دل ہی اس کا جواب دے سکتا ہے۔,11,only your heart can answer that.,6,,
Umm-e-Haniya,00:12:33.320,میں اب اپنے دل کی بات نہیں سنوں گا,9,I won’t listen to my heart now,7,,
Umm-e-Haniya,00:12:35.920,ورنہ میں ایک بار پھر رک جاؤں گا,8,else I would stop once again,6,,
Umm-e-Haniya,00:12:39.040,اور میں ابھی رکنا نہیں چاہتا،,6,"and I don’t want to stop now,",7,,
Umm-e-Haniya,00:12:41.920,کیونکہ اب کامل کی محبت کا امتحان ہے،,8,"because it is the test of Kamil’s love now,",9,,
Umm-e-Haniya,00:12:45.240,اگر وہ واقعی مجھ سے محبت کرتا ہے تو,9,"if he actually loves me,",5,,
Umm-e-Haniya,00:12:48.200,وہ میرے واپس آنے کا انتظار ضرور کرے گا۔,9,he will definitely wait for me to come back.,9,,
Umm-e-Haniya,00:12:51.960,ٹھیک ہے پھر اٹھو اور جانے کے لیے تیار ہو جاؤ، چلو۔,12,"Okay then, get up and get ready to leave,",9,,
Umm-e-Haniya,00:12:59.200,ماں،,1,"Mom,",1,,
Umm-e-Haniya,00:13:02.280,میں نے اپنا کام چھوڑ دیا ہے۔,7,I have quit my job.,5,,
Umm-e-Haniya,00:13:03.800,کیا؟  کیوں؟,2,What? Why?,2,,
Umm-e-Haniya,00:13:06.520,یہ اتنی اچھی جگہ تھی۔,5,It was such a good place.,6,,
Umm-e-Haniya,00:13:10.240,ماں، سمجھنے کی کوشش کرو،,5,"Mom, try to understand,",4,,
Umm-e-Haniya,00:13:12.480,کبھی کبھی، آگے بڑھنے کے لئے،,6,"sometimes, to move forward,",4,,
Umm-e-Haniya,00:13:15.640,لیکن انجم، تم میں سے کیا کام نہیں ملتا؟,9,"But Anjum, what of you don’t get another job?",9,,
Umm-e-Haniya,00:13:20.440,اس گھر کے اخراجات کیسے پورے ہوں گے؟,8,How will the expenses of this house get fulfilled?,9,,
Umm-e-Haniya,00:13:23.080,کامل کی تنخواہ سے گزارہ مشکل ہو جائے گا۔,9,It will get difficult to survive with Kamil’s salary only.,10,,
Umm-e-Haniya,00:13:26.600,امی، بھائی نے فنانس میں ماسٹرز کیا ہے،,8,"Mom, brother has done his masters in finance,",8,,
Umm-e-Haniya,00:13:30.520,اسے اچھی پوزیشن پر کوئی بھی نوکری آسانی سے مل جائے گی۔,12,he will easily get any job on a good position.,10,,
Umm-e-Haniya,00:13:34.520,بس کل سے کوئی اور کام ڈھونڈنا شروع کر دو،,10,"Just start looking for another job from tomorrow,",8,,
Umm-e-Haniya,00:13:36.840,اگر کامل کی شادی طے ہو گئی تو,8,"if Kamil’s marriage gets fixed,",5,,
Umm-e-Haniya,00:13:39.200,ہمیں اس کی شادی پر سمجھداری سے خرچ کرنا پڑے گا۔,11,we have to spend wisely on his wedding.,8,,
Umm-e-Haniya,00:13:41.440,کامل کی شادی؟,3,Kamil’s marriage?,2,,
Umm-e-Haniya,00:13:43.320,ہمم، مجھے اس کا بندوبست کرنا ہے۔,7,"Hmm, I have to get him settled.",7,,
Umm-e-Haniya,00:13:46.600,سلام، ماں.,2,"Greetings, mom.",2,,
Umm-e-Haniya,00:13:48.160,سلام،,1,"Greetings,",1,,
Umm-e-Haniya,00:13:50.440,آپ لمبی عمر پائیں، ہم صرف آپ کی تجویز پر بات کریں گے۔,13,"you will live long, we will just talking",8,,
Umm-e-Haniya,00:13:53.720,آؤ کھانا کھاؤ۔,3,Come and have food.,4,,
Umm-e-Haniya,00:13:54.920,آؤ بھائی۔  ماں نے,4,"Come, brother. Mom has already",5,,
Umm-e-Haniya,00:13:58.600,ہاں مجھے کامل کو سیٹل کروانا ہے،,7,"Yes, I have to get Kamil settled,",7,,
Umm-e-Haniya,00:14:01.480,میں نے ایک لڑکی کا انتخاب بھی کیا ہے،,9,"I have even chosen a girl,",6,,
Umm-e-Haniya,00:14:03.720,وہ ایک امیر گھرانے کی پڑھی لکھی لڑکی ہے۔,9,she is an educated girl from a rich family.,9,,
Umm-e-Haniya,00:14:06.320,کل شام کو آفس سے جلدی آجاؤ،,7,"Come early from office tomorrow evening,",6,,
Umm-e-Haniya,00:14:08.240,ہم ان سے ملیں گے، سنداس ساتھ ٹیگ کریں گے۔,10,"we will visit them, Sundas will tag along.",8,,
Umm-e-Haniya,00:14:13.080,ماں، میں کسی تجویز کے لیے نہیں جا رہی،,9,"Mom, I am not going for any proposal,",8,,
Umm-e-Haniya,00:14:16.200,تم اور سندس، مجھے اکیلا چھوڑ دو!,7,"you and Sundas, please leave me alone!",7,,
Umm-e-Haniya,00:14:29.840,جی ہاں!,2,Yes!,1,,
