Drama Name,Timestamp,Urdu Subtitle,Urdu Length,English Subtitle,English Length,Episode,Genre
Umm-e-Haniya,00:37:29.960,رومی کی شادی ہو گئی ہے اور وہ,8,Rumi has gotten married and she has gone,8,,
Umm-e-Haniya,00:37:38.560,کیا آپ اب بھی ہر وقت رومی کے بارے میں سوچتے ہیں؟,12,Do you still think about Rumi all the time?,9,,
Umm-e-Haniya,00:37:47.760,کہاں جا رہے ہو؟,4,Where are you going?,4,,
Umm-e-Haniya,00:37:51.640,کیا ہوا رحمان؟,3,"What happened, Rehman?",3,,
Umm-e-Haniya,00:37:55.320,جی ہاں  پانی۔,3,Yes. Water.,2,,
Umm-e-Haniya,00:37:57.800,ٹھیک ہے، میں آپ کو دے رہا ہوں،,8,"Okay, I am giving it to you,",7,,
Umm-e-Haniya,00:38:02.080,یہاں، پانی ہے.,3,"Here, have water.",3,,
Umm-e-Haniya,00:38:13.760,کیا آپ بہتر محسوس کر رہے ہیں؟,7,Are you feeling better?,4,,
Umm-e-Haniya,00:38:16.400,ہاں، میں ہوں۔,3,"Yes, I am.",3,,
Umm-e-Haniya,00:38:19.480,لیکن پھر بھی اٹھو، میں تمہیں ڈاکٹر کے پاس لے چلوں،,11,"But still get up, let me take you to the doctor,",11,,
Umm-e-Haniya,00:38:23.720,درد پھر بڑھ سکتا ہے۔,5,the pain might increase again.,5,,
Umm-e-Haniya,00:38:25.600,نہیں، اس کی ضرورت نہیں،,5,"No, that is not needed,",5,,
Umm-e-Haniya,00:38:29.160,مجھے اکیلا چھوڑ دو۔,4,leave me alone.,3,,
Umm-e-Haniya,00:38:31.720,رحمان؟,1,Rehman?,1,,
Umm-e-Haniya,00:00:06.720,ٹھیک ہے مجھے کچھ بتاؤ،,5,"Okay tell me something,",4,,
Umm-e-Haniya,00:00:08.920,تم نے,2,you have thought of a few,6,,
Umm-e-Haniya,00:00:11.000,مجھے بھی بتاؤ؟,3,Tell me as well?,4,,
Umm-e-Haniya,00:00:12.840,ابھی نہیں،,2,"Not right now,",3,,
Umm-e-Haniya,00:00:14.280,میں آپ کو بتاؤں گا جب,6,I will tell you when,5,,
Umm-e-Haniya,00:00:15.960,ٹھیک ہے،,2,"Okay fine,",2,,
Umm-e-Haniya,00:00:18.680,میں نے بھی کچھ نام سوچ لیے ہیں,8,I have thought of some names too,7,,
Umm-e-Haniya,00:00:22.120,اس میں اتنا پریشان ہونے کی کیا بات ہے؟,9,What is there to get so upset about it?,9,,
Umm-e-Haniya,00:00:25.240,ٹھیک ہے پہلے تم بتاؤ،,5,"Okay first you tell me,",5,,
Umm-e-Haniya,00:00:29.520,لڑکا ہوگا یا لڑکی؟,4,will it be a boy or a girl?,8,,
Umm-e-Haniya,00:00:32.960,اب یہ ایک مشکل ہے۔,5,Now that’s a tough one.,5,,
Umm-e-Haniya,00:00:35.560,اس میں اتنی سخت کیا بات ہے؟,7,What’s so tough about it?,5,,
Umm-e-Haniya,00:00:37.560,آپ کو صرف اندازہ لگانا ہے؟,6,You just have to guess?,5,,
Umm-e-Haniya,00:00:39.480,بتاؤ؟,1,Tell me?,2,,
Umm-e-Haniya,00:00:40.880,لڑکی یا لڑکا؟,3,Girl or boy?,3,,
Umm-e-Haniya,00:00:43.920,میرا اندازہ ہے کہ یہ بیٹا ہوگا,7,I guess it would be a son,7,,
Umm-e-Haniya,00:00:47.520,اور تمہیں کیا لگتا ہے؟,5,and what do you feel?,5,,
Umm-e-Haniya,00:00:54.400,بیٹی۔,1,Daughter.,1,,
Umm-e-Haniya,00:00:57.440,روحان!,1,Rohan!,1,,
Umm-e-Haniya,00:01:34.400,مدد!,1,Help!,1,,
Umm-e-Haniya,00:01:37.000,میری بیوی کی مدد کرو!,5,Help my wife!,3,,
Umm-e-Haniya,00:01:39.880,پلیز میری بیوی کی مدد کریں۔,6,Help my wife please.,4,,
Umm-e-Haniya,00:01:44.720,جی ہاں,2,Yes.,1,,
Umm-e-Haniya,00:01:56.600,میری بیوی کی مدد کرو!,5,Help my wife!,3,,
Umm-e-Haniya,00:02:02.680,اوہ میرے خدا!,3,Oh my God!,3,,
Umm-e-Haniya,00:02:07.360,میری بیوی کی مدد کرو!,5,Help my wife!,3,,
Umm-e-Haniya,00:02:08.960,مدد!,1,Help!,1,,
Umm-e-Haniya,00:02:13.720,میری بیوی کی مدد کرو!,5,Help my wife!,3,,
Umm-e-Haniya,00:02:16.160,ارے!,1,Hey!,1,,
Umm-e-Haniya,00:02:18.240,ارے پلیز میری بیوی کی مدد کرو!,7,"Hey please, help my wife!",5,,
Umm-e-Haniya,00:02:20.680,ارے سنو۔,2,Hey listen?,2,,
Umm-e-Haniya,00:02:23.360,مدد؟  صبا,2,Help?,1,,
Umm-e-Haniya,00:02:25.440,!,1,Saba!,1,,
Umm-e-Haniya,00:02:27.280,میری بیوی کی مدد کرو!,5,Help my wife!,3,,
Umm-e-Haniya,00:02:29.960,ہیلو،,1,"Hello,",1,,
Umm-e-Haniya,00:02:31.920,براہ کرم میری بیوی کی مدد کریں!,7,Please help my wife!,4,,
Umm-e-Haniya,00:02:34.400,ارے؟,1,Hey?,1,,
Umm-e-Haniya,00:02:37.960,صبا؟,1,Saba?,1,,
Umm-e-Haniya,00:02:41.880,صبا؟,1,Saba?,1,,
Umm-e-Haniya,00:02:52.920,ابا؟,1,Dad?,1,,
Umm-e-Haniya,00:02:54.120,رومی، میرے بچے؟,3,"Rumi, my child?",3,,
Umm-e-Haniya,00:02:55.760,کیا ہوا؟  کامل نہیں آیا؟,5,What happened? Kamil didn’t come?,5,,
Umm-e-Haniya,00:02:57.440,نہیں پاپا میں,3,"No dad, I have been trying to call",8,,
Umm-e-Haniya,00:03:00.000,میں نے ابھی کچھ دیر پہلے اس سے بات کی تھی,11,I just spoke to him a while back,8,,
Umm-e-Haniya,00:03:03.600,میں تب سے انتظار کر رہا ہوں۔,7,I have been waiting since then.,6,,
Umm-e-Haniya,00:03:05.240,ہو سکتا ہے وہ کسی دفتری کام میں پھنس گیا ہو۔,11,He might be stuck in some office work.,8,,
Umm-e-Haniya,00:03:08.360,کامل ایسا ہی ہے، وہ ہمیشہ ایسا ہی کرتا ہے،,10,"That’s how Kamil is, he always does this,",8,,
Umm-e-Haniya,00:03:10.920,دیر سے آنے والا، میں نے اسے بتایا کہ,9,"late comer, I even told him",6,,
Umm-e-Haniya,00:03:14.920,کوئی بات نہیں، میں آپ کو ہسپتال لے چلوں۔,9,"No problem, let me take you",6,,
Umm-e-Haniya,00:03:18.760,یہ کوئی مسئلہ نہیں ہے،,5,"That’s not a problem, let’s wait",6,,
Umm-e-Haniya,00:03:22.520,ٹھیک ہے، اس دوران,4,"Okay fine,",2,,
Umm-e-Haniya,00:03:23.640,مجھے تمہاری ماں کے ساتھ چائے پینے دو,8,let me have tea with your mother,7,,
Umm-e-Haniya,00:03:27.240,ٹھیک ہے بابا۔,3,Okay dad.,2,,
Umm-e-Haniya,00:03:28.880,اور شازیہ کا کیا ہوگا؟,5,And what about Shazia?,4,,
Umm-e-Haniya,00:03:33.480,نہیں بابا، میں نے اس سے بات نہیں کی،,9,"No dad, I didn’t speak to her,",7,,
Umm-e-Haniya,00:03:37.800,اور روحان کہاں ہے؟,4,And where is Rohan? It has been,7,,
Umm-e-Haniya,00:03:43.480,ہاں ابا، میں نے اس سے بات تک نہیں کی،,10,"Yes, dad, I didn’t even speak to him,",8,,
Umm-e-Haniya,00:03:46.960,وہ امریکہ شفٹ ہونے والے تھے,6,he was about to shift to America to settle,9,,
Umm-e-Haniya,00:03:53.360,ٹھیک ہے۔,2,Okay fine.,2,,
Umm-e-Haniya,00:04:07.600,یہ بہت غلط ہے،,4,"This is so wrong,",4,,
Umm-e-Haniya,00:04:10.360,اب کیا ہوگا؟,3,what will happen now?,4,,
Umm-e-Haniya,00:04:21.680,پتہ نہیں وہ زندہ رہیں گے یا نہیں؟,8,I don’t know will they survive or not?,8,,
Umm-e-Haniya,00:04:27.560,وہ مر جائیں تو کیا ہوگا؟,6,What if they die?,4,,
Umm-e-Haniya,00:04:40.200,نہیں،,1,"No,",1,,
Umm-e-Haniya,00:04:42.040,کسی کو اس حادثے کی خبر نہیں ہونی چاہیے,9,no one should know about this accident,7,,
Umm-e-Haniya,00:04:45.200,ورنہ میں مر جاؤں گا۔,5,else I will be dead.,5,,
Umm-e-Haniya,00:05:19.000,میں ٹھیک ہوں شازیہ,4,"I am fine Shazia,",4,,
Umm-e-Haniya,00:05:20.880,آپ کیسی ہیں؟,3,how are you?,3,,
Umm-e-Haniya,00:05:22.920,مجھے ابھی آرام کرنا ہے۔,5,I just have to rest now.,6,,
Umm-e-Haniya,00:05:25.200,مجھے بتائیں کہ آپ کے انتخاب کے بارے میں کیا ہوا,11,Tell me what happened about,5,,
Umm-e-Haniya,00:05:27.560,اسی کے لیے میں نے دن کہا۔,7,That’s what I called din for.,6,,
Umm-e-Haniya,00:05:30.200,رومی، میں منتخب ہو گیا ہوں۔,6,"Rumi, I am selected.",4,,
Umm-e-Haniya,00:05:32.680,کیا؟,1,What?,1,,
Umm-e-Haniya,00:05:34.920,یہ حیرت انگیز ہے!,4,That’s amazing!,2,,
Umm-e-Haniya,00:05:36.960,میں آپ کے لیے بہت خوش ہوں شازیہ،,8,"I am very happy for you Shazia,",7,,
Umm-e-Haniya,00:05:40.080,آپ کی محنت بالآخر رنگ لائی۔,6,your hard work was finally fruitful.,6,,
Umm-e-Haniya,00:05:41.960,آپ کا بہت شکریہ,4,"Thank you so much,",4,,
Umm-e-Haniya,00:05:43.640,لیکن,1,but,1,,
Umm-e-Haniya,00:05:45.040,میری خوشی آپ کے بغیر ادھوری ہے۔,7,my happiness is incomplete without you.,6,,
Umm-e-Haniya,00:05:48.120,اگر,1,It would have been so nice had,7,,
Umm-e-Haniya,00:05:53.720,ہاں،,1,"Yes,",1,,
Umm-e-Haniya,00:05:55.200,لیکن یہ کوئی مسئلہ نہیں ہے،,6,"but that’s not a problem,",5,,
Umm-e-Haniya,00:05:57.360,یہ سب کچھ کسی کی قسمت پر منحصر ہے،,9,"that all depends on one’s fate,",6,,
Umm-e-Haniya,00:06:00.400,یہ یہاں تک میری قسمت میں تھا۔,7,it was until here in my fate.,7,,
Umm-e-Haniya,00:06:02.720,تم جانتے ہو کیا؟,4,You know what?,3,,
Umm-e-Haniya,00:06:03.880,کوچ نے نیویرا کے خلاف بہت سنگین شکایت درج کرائی ہے,11,Coach has filed a very serious,6,,
Umm-e-Haniya,00:06:07.200,لیکن پھر بھی انہیں سورس پر منتخب کیا گیا ہے۔,10,but she is still got selected on source.,8,,
Umm-e-Haniya,00:06:10.200,اس کے بارے میں بھول جاؤ،,6,"Forget about he,",3,,
Umm-e-Haniya,00:06:11.720,جو کچھ بھی ہوتا ہے، اچھے کے لیے ہوتا ہے،,10,"whatever happens, happens for good,",5,,
Umm-e-Haniya,00:06:13.560,تم بس اپنا خیال رکھو,5,you just take care of yourself,6,,
Umm-e-Haniya,00:06:17.560,پریشان نہ ہوں، میں اسے اچھا سبق سکھاؤں گا۔,9,"Don’t worry, I’ll teach her a good lesson.",8,,
Umm-e-Haniya,00:06:23.240,آپ فکر نہ کریں،,4,"You don’t worry,",3,,
Umm-e-Haniya,00:06:25.040,چند مہینوں میں,3,there will be trials in a few months,8,,
Umm-e-Haniya,00:06:27.400,ہاں، میں آپ کو بعد میں کال کروں گا۔,9,"Yes, I will call you later.",6,,
Umm-e-Haniya,00:06:56.040,یہاں.,1,Here.,1,,
Umm-e-Haniya,00:06:57.360,ہاں لے آؤ۔,3,"Yes, bring it.",3,,
Umm-e-Haniya,00:06:58.800,شکریہ,1,Thank you,2,,
Umm-e-Haniya,00:07:03.040,سنو،,1,"Listen,",1,,
Umm-e-Haniya,00:07:05.360,رومی شادی تک ٹھیک ہو جائے گا نا؟,8,Rumi will get fine until wedding right?,7,,
Umm-e-Haniya,00:07:09.320,کتنی بار,2,How many times will,4,,
Umm-e-Haniya,00:07:14.280,رومی ایک سپورٹس ویمن ہیں،,5,"Rumi is a sports woman,",5,,
Umm-e-Haniya,00:07:16.400,وہ جلد ٹھیک ہو جائیں گی، فکر نہ کریں۔,9,"she will get fine soon, don’t worry.",7,,
Umm-e-Haniya,00:07:21.320,میں کیا کروں؟,3,What shall i do?,4,,
Umm-e-Haniya,00:07:23.120,میں پریشان ہوں,3,I am worried.,3,,
Umm-e-Haniya,00:07:30.200,ارے تم باہر کیوں آئے ہو؟   کیا,7,"Hey, why did you come out?",6,,
Umm-e-Haniya,00:07:33.480,آپ کو کیا ہوا ہے ماں؟,6,What is wrong with you mom?,6,,
Umm-e-Haniya,00:07:37.600,لیکن میرے بچے، ڈاکٹر نے,5,"But my child, doctor has asked",6,,
Umm-e-Haniya,00:07:42.840,اکیلے بیٹھنے سے ایک شخص بیمار ہو جاتا ہے,9,A person gets sick by sitting all alone,8,,
Umm-e-Haniya,00:07:46.920,اور رومی میری بہادر لڑکی ہے۔,6,and Rumi is my brave girl.,6,,
Umm-e-Haniya,00:07:50.560,آپ کو آج ڈاکٹر کے پاس جانا تھا؟,8,You had to go to the doctor today?,8,,
Umm-e-Haniya,00:07:53.160,ہاں میں پوچھنا بالکل بھول گیا،,6,"Yes, I totally forgot asking,",5,,
Umm-e-Haniya,00:07:55.680,کامل فون نہیں اٹھا رہا،,5,"Kamil is not picking up the phone,",7,,
Umm-e-Haniya,00:07:59.160,پاپا میں بہت ناراض ہوں بس اسے رہنے دو۔,9,dad I am so angry just let him be.,9,,
Umm-e-Haniya,00:08:02.320,کیا آپ مجھے ہسپتال لے جائیں گے؟,7,Will you take me to the hospital?,7,,
Umm-e-Haniya,00:08:04.440,میں نے پہلے ہی آپ کو پیشکش کی تھی،,9,"I already offered you,",4,,
Umm-e-Haniya,00:08:06.640,میں گاڑی نکال کر لاتا ہوں، آپ آجائیں۔,8,"I’ll take the car out, you come.",7,,
Umm-e-Haniya,00:08:09.520,ٹھیک ہے۔  کم,3,Okay.,1,,
Umm-e-Haniya,00:08:10.280,از کم چائے تو پی لیں۔,6,At least have tea.,4,,
Umm-e-Haniya,00:08:11.840,واپس آنے کے بعد لے لوں گا۔,7,I’ll have it after coming back.,6,,
Umm-e-Haniya,00:08:24.000,کامل کال نہیں اٹھا رہا،,5,"Kamil is not picking up the call,",7,,
Umm-e-Haniya,00:08:27.360,کیا ہوا ہوگا؟,3,what must have happened?,4,,
Umm-e-Haniya,00:08:36.960,ہاں سنداس؟,2,Yes Sundas?,2,,
Umm-e-Haniya,00:08:38.040,کامل کہاں ہو؟,3,Where are you Kamil?,4,,
Umm-e-Haniya,00:08:42.120,میں تھوڑا مصروف ہوگیا،,4,"I got a little busy,",5,,
Umm-e-Haniya,00:08:44.120,رومی کو انتظار کرنے کو کہو، میں آرہا ہوں۔  کوئی,10,"ask Rumi to wait, I am coming.",7,,
Umm-e-Haniya,00:08:45.920,فائدہ نہیں، وہ چچا کے ساتھ چلی گئی۔,8,"It’s of no use, she went with uncle.",8,,
Umm-e-Haniya,00:08:49.200,اچھا، ٹھیک ہے بہن، میں تمہیں بعد میں کال کروں گا۔,11,"Good, okay sister, I’ll call you later.",7,,
Umm-e-Haniya,00:08:54.200,ارے، کامل؟,2,"Hey, Kamil?",2,,
Umm-e-Haniya,00:08:56.480,میری بات سنو۔,3,Listen to me?,3,,
Umm-e-Haniya,00:08:58.720,وہ پہلے ہی لٹکا ہوا ہے۔,6,He already hang up.,4,,
Umm-e-Haniya,00:09:03.760,کیا ہوا ہے؟  ایسا,4,What has happened?,3,,
Umm-e-Haniya,00:09:32.760,لگتا ہے جیسے کوئی شدید حادثہ ہو۔,7,It looks like a severe accident.,6,,
Umm-e-Haniya,00:09:35.440,خدا ان کو لمبی عمر دے۔,6,May God give them a long life.,7,,
Umm-e-Haniya,00:09:38.000,آمین۔,1,Amen.,1,,
Umm-e-Haniya,00:09:51.000,ٹھیک ہے رومی، میں نے,5,"Okay Rumi, I have checked",5,,
Umm-e-Haniya,00:09:54.840,بس آپ دوائیاں لیتے رہیں۔,5,just keep on taking your medicines.,6,,
Umm-e-Haniya,00:09:57.560,ہاں ڈاکٹر،,2,"Yes doctor,",2,,
Umm-e-Haniya,00:09:58.880,ذرا مجھے یہ پٹی اتار دیں،,6,"just get me rid of this bandage,",7,,
Umm-e-Haniya,00:10:01.680,میں بہت چڑچڑا ہوں۔,4,I feel so irritated.,4,,
Umm-e-Haniya,00:10:03.480,آپ کو مزید ایک,4,You have  to bear with the,6,,
Umm-e-Haniya,00:10:06.880,لیکن ہاں اس کے بعد میں کہہ سکتا ہوں,9,but yes after that I can say,7,,
Umm-e-Haniya,00:10:11.440,دراصل ڈاکٹر صاحب،,3,"Actually doctor,",2,,
Umm-e-Haniya,00:10:13.360,اس کی شادی کی تاریخ ایک ماہ بعد رکھی گئی ہے۔,11,her wedding date has been set after a month.,9,,
Umm-e-Haniya,00:10:17.240,اوہ اچھا، مبارک ہو۔,4,"Oh nice, congratulations.",3,,
Umm-e-Haniya,00:10:19.840,شکریہ,1,Thank you.,2,,
Umm-e-Haniya,00:10:21.880,آپ کو بھی آنا چاہیے۔,5,You should come too.,4,,
Umm-e-Haniya,00:10:23.480,انشاءاللہ۔,1,InshaAllah.,1,,
Umm-e-Haniya,00:10:40.160,بھائی,1,"Brother,",1,,
Umm-e-Haniya,00:10:42.320,میری گاڑی چیک کرو۔,4,check my car.,3,,
Umm-e-Haniya,00:10:44.120,ضرور،,1,"Sure,",1,,
Umm-e-Haniya,00:10:52.880,لائٹس بند کر دیں۔,4,switch off the lights.,4,,
Umm-e-Haniya,00:11:01.280,ایسا لگتا ہے کہ آپ نے,6,It looks like you have done,6,,
Umm-e-Haniya,00:11:04.840,نہیں، یہ کوئی حادثہ نہیں ہے،,6,"No, it’s not an accident,",5,,
Umm-e-Haniya,00:11:06.800,میں غلطی سے گلی کے کھمبے سے ٹکرا گیا،,9,"I mistakenly bumped in to the street pole,",8,,
Umm-e-Haniya,00:11:09.400,اللہ کا شکر ہے کہ میں محفوظ ہوں۔,8,"thank God I am, safe.",5,,
Umm-e-Haniya,00:11:10.920,مجھے بتائیں کہ,3,Tell me how much will,5,,
Umm-e-Haniya,00:11:13.720,دوسرے دن لے لو،,4,"Take it on the second day,",6,,
Umm-e-Haniya,00:11:16.440,بیس ہزار لگیں گے۔,4,"it will cost 20,000.",4,,
Umm-e-Haniya,00:11:17.920,"20,000؟",1,"20,000?",1,,
Umm-e-Haniya,00:11:19.000,جناب گاڑی کی حالت دیکھیں،,5,"Sir look at the condition of the car,",8,,
Umm-e-Haniya,00:11:22.000,خدا جانے,2,God knows how many,4,,
Umm-e-Haniya,00:11:24.240,20 ہزار برا نہیں ہے۔,5,"20,000 is not bad.",4,,
Umm-e-Haniya,00:11:25.520,کیا کوڑا؟,2,What rubbish?,2,,
Umm-e-Haniya,00:11:26.800,میں نے کسی کو نہیں مارا، میں نے تم سے کہا!,11,"I haven’t hit anyone, I told you!",7,,
Umm-e-Haniya,00:11:28.800,تم پاگل کیوں ہو رہے ہو؟,6,Why are you getting mad?,5,,
Umm-e-Haniya,00:11:30.680,مجھے پیسے دو اور,4,Give me the money and,5,,
Umm-e-Haniya,00:11:35.240,"میں کبھی بھی 20,000 ادا نہیں کروں گا!",8,"I will never pay 20,000!",5,,
Umm-e-Haniya,00:11:52.640,اس لڑکی کے دل کی دھڑکن کم ہو رہی ہے,10,That girl’s heart beat is dropping,6,,
Umm-e-Haniya,00:11:55.280,اور وہ حاملہ بھی ہے،,5,"and she is even pregnant,",5,,
Umm-e-Haniya,00:11:56.960,ڈاکٹر اینا کی فوری منگنی کریں۔,6,engage Dr. Ana urgently.,4,,
Umm-e-Haniya,00:11:59.120,ٹھیک ہے۔,2,Okay.,1,,
Umm-e-Haniya,00:11:59.600,اس مرد مریض کی کیا حیثیت ہے؟,7,What is the position of that male patient?,8,,
Umm-e-Haniya,00:12:01.400,وہ بہت نازک ہے، ڈاکٹر نذیر آپریشن کر رہے ہیں۔,10,"He is very critical, Dr. Nazeer is operating.",8,,
Umm-e-Haniya,00:12:04.400,وہ کون ہیں کے بارے میں کوئی معلومات؟,8,Any information about who they are?,6,,
Umm-e-Haniya,00:12:06.320,کیا وہ میاں بیوی ہیں؟,5,Are they husband and wife?,5,,
Umm-e-Haniya,00:12:07.720,آپ نے ٹھیک کہا، ہمیں,5,"You are right, we have found",6,,
Umm-e-Haniya,00:12:11.000,ہم نے پولیس کو بھی اطلاع کر دی ہے۔,9,we have informed the police too.,6,,
Umm-e-Haniya,00:12:12.440,ان کے گھر والوں کو بھی اطلاع دیں۔,8,inform their family too.,4,,
Umm-e-Haniya,00:12:13.880,ان کی حالت انتہائی تشویشناک ہے۔  ضرور,7,Their condition is very serious.,5,,
Umm-e-Haniya,00:12:28.960,سلام، ماں.,2,"Greetings, mom.",2,,
Umm-e-Haniya,00:12:30.120,سلام۔,1,Greetings.,1,,
Umm-e-Haniya,00:12:33.040,میمونہ؟,1,Maimuna?,1,,
Umm-e-Haniya,00:12:34.240,جی ہاں؟,2,Yes?,1,,
Umm-e-Haniya,00:12:34.600,میرے لیے چائے بنا لو میرے,6,Make tea for my I am having,7,,
Umm-e-Haniya,00:12:36.920,میں بس اسے حاصل کروں گا۔,6,I’ll just get it.,4,,
Umm-e-Haniya,00:12:38.840,یہاں، یہ ہے.,3,"Here, have this.",3,,
Umm-e-Haniya,00:12:40.280,نہیں ماں، آپ کے پاس ہے،,6,"No mom, you have it,",5,,
Umm-e-Haniya,00:12:41.720,وہ میرے لیے لے جائے گی۔,6,she will get it for me.,6,,
Umm-e-Haniya,00:12:48.920,وہ کس کا نمبر ہے؟,5,Whose number is that?,4,,
Umm-e-Haniya,00:12:52.520,ہیلو؟,1,Hello?,1,,
Umm-e-Haniya,00:12:54.560,ہاں بول رہا ہوں۔,4,"Yes, speaking.",2,,
Umm-e-Haniya,00:12:57.720,جی ہاں؟,2,Yes?,1,,
Umm-e-Haniya,00:12:59.920,لیکن وہ تھے؟,3,But they were?,3,,
Umm-e-Haniya,00:13:08.040,کیا ہوا ماں؟  کس کی کال تھی؟,7,What happened mom? Whose call was it?,7,,
Umm-e-Haniya,00:13:13.120,روحان اور صبا کو حادثہ پیش آیا۔,7,Rohan and Saba met an accident.,6,,
Umm-e-Haniya,00:13:17.920,کیا؟,1,What?,1,,
Umm-e-Haniya,00:14:13.080,بھائی۔,1,Brother?,1,,
Umm-e-Haniya,00:14:15.080,اچھا ہوا تم یہاں ہو،,5,"It good that you are here,",6,,
Umm-e-Haniya,00:14:16.480,دیکھو انجم میرے لیے پیزا نہیں لا رہا،,8,"look Anjum is not bringing pizza for me,",8,,
Umm-e-Haniya,00:14:19.800,آپ اسے کیوں لانا چاہتے ہیں؟,6,Why do you want to bring it?,7,,
Umm-e-Haniya,00:14:21.560,مطلب، آپ ادا کر رہے ہیں؟  مجھے حکم جانا چاہئے؟,10,"Means, you are paying? I should go order?",8,,
Umm-e-Haniya,00:14:23.440,ہاں میں ادائیگی کروں گا، جاؤ آرڈر کرو۔,8,"Yes I will pay, go order.",6,,
Umm-e-Haniya,00:14:25.040,جی ہاں!,2,Yes!,1,,
Umm-e-Haniya,00:14:27.400,بھائی۔,1,Brother?,1,,
Umm-e-Haniya,00:14:29.480,آپ کی گاڑی کو کیا ہوا؟  ایسا,7,What happened to your car?,5,,
Umm-e-Haniya,00:14:34.040,لگتا ہے کہ آپ کو ایک بہت برا حادثہ ہوا ہے؟,11,Looks like you met a very bad accident?,8,,
Umm-e-Haniya,00:14:36.240,کیا تم پاگل ہو؟  حادثہ؟,5,Are you mad? Accident?,4,,
Umm-e-Haniya,00:14:40.080,ہاں،,1,"Yes,",1,,
Umm-e-Haniya,00:14:41.800,میرے دوست نے گاڑی کو ٹکر ماری، دیکھو اس نے میری گاڑی کو کیا کیا؟,15,"my friend hit the car, look what he did to my car.",12,,
Umm-e-Haniya,00:14:46.040,واہ،,1,"Wow,",1,,
Umm-e-Haniya,00:14:47.080,جب ہم مانگتے ہیں تو آپ ہمیں گاڑی نہیں دیتے,10,you never give us the car when,7,,
Umm-e-Haniya,00:14:52.480,آپ کو یہ کرنا ہوگا، آپ نہیں سمجھیں گے.,9,"You have to do it, you won’t understand.",8,,
Umm-e-Haniya,00:14:55.080,میں اسے ابھی کروں گا۔,5,I will do it right now.,6,,
Umm-e-Haniya,00:14:56.080,ٹھیک ہے سنو؟,3,Okay listen?,2,,
Umm-e-Haniya,00:14:57.720,جی ہاں؟,2,Yes?,1,,
Umm-e-Haniya,00:14:59.200,یہ بات اندر سے کسی کو مت بتانا۔,8,Don’t tell this to anyone inside.,6,,
Umm-e-Haniya,00:15:02.440,کس بارے میں؟,3,About what?,2,,
Umm-e-Haniya,00:15:04.720,حادثے کے بارے میں۔,4,About the accident.,3,,
Umm-e-Haniya,00:15:06.840,میں نہیں جانتا کہ آپ کس بارے میں بات کر رہے ہیں؟,12,I don’t know what are you talking about?,8,,
Umm-e-Haniya,00:15:09.400,کیا؟,1,What?,1,,
Umm-e-Haniya,00:15:10.720,جی ہاں,2,Yes.,1,,
Umm-e-Haniya,00:15:49.160,اس کی حالت اتنی سنگین تھی کہ,7,Her condition was so serious that,6,,
Umm-e-Haniya,00:16:08.440,لیکن ہاں ہم نے صبا کی بیٹی کو بچا لیا ہے۔,11,but yes we have saved Saba’s daughter.,7,,
Umm-e-Haniya,00:16:11.640,بیٹی۔,1,Daughter?,1,,
Umm-e-Haniya,00:16:13.000,ہاں، وہ حاملہ تھی، کیا آپ نہیں جانتے تھے؟,9,"Yes, she was pregnant, didn’t you know?",7,,
Umm-e-Haniya,00:16:19.120,مجھے معلوم تھا،,3,"I knew it,",3,,
Umm-e-Haniya,00:16:21.360,کیا بیٹی بچ گئی؟,4,did the daughter survive?,4,,
Umm-e-Haniya,00:16:24.280,ہاں وہ ڈیلیوری تک زندہ تھی,6,"Yes, she was alive till the delivery",7,,
Umm-e-Haniya,00:16:27.880,لیکن پھر صبا چل بسی۔,5,but then Saba passed away.,5,,
Umm-e-Haniya,00:17:01.920,ڈاکٹر صاحب,2,"Doctor,",1,,
Umm-e-Haniya,00:17:03.920,میرے بیٹے کو کیا ہوا؟,5,what happened to my son?,5,,
Umm-e-Haniya,00:17:06.520,اسے کیا ہوا،,3,"What happened to him,",4,,
Umm-e-Haniya,00:17:09.920,اللہ کا شکر ہے کہ آپ کا بیٹا بچ گیا،,10,"Thank god that your son survived,",6,,
Umm-e-Haniya,00:17:13.000,سر پر معمولی خراشیں ہیں,5,there are just minor scratches on the head,8,,
Umm-e-Haniya,00:17:14.840,اور ہاتھ میں فریکچر ہے جس کی,7,and there is a fracture in the hand,8,,
Umm-e-Haniya,00:17:18.360,لیکن وہ اس وقت کومہ میں ہے۔,7,but he is in coma right now.,7,,
Umm-e-Haniya,00:17:20.800,ڈاکٹر صاحب کچھ بھی کریں اور,6,"Doctor, do anything and make",5,,
Umm-e-Haniya,00:17:25.080,بس جو بھی کرنا ہو کر لیں۔,7,just do whatever it takes.,5,,
Umm-e-Haniya,00:17:27.240,صبر کرو،,2,"Have patience,",2,,
Umm-e-Haniya,00:17:28.600,ہم اسے ہوش میں لانے کی پوری کوشش کر رہے ہیں۔,11,we are trying our best to get him conscious.,9,,
Umm-e-Haniya,00:17:31.560,بس اس کے لیے دعا کریں۔,6,Just pray for him.,4,,
Umm-e-Haniya,00:17:33.960,نرس، اسے باہر لے جاؤ.,5,"Nurse, take her out.",4,,
Umm-e-Haniya,00:17:52.120,پلیز میری بیوی کی مدد کریں۔,6,Help my wife please.,4,,
Umm-e-Haniya,00:17:59.000,مدد!,1,Help!,1,,
Umm-e-Haniya,00:18:02.840,میری بیوی کی مدد کرو!,5,Help my wife!,3,,
Umm-e-Haniya,00:18:28.680,ہاں، تو آپ کس سے بات کرنا چاہتے ہیں؟,9,"Yes, so who do you want to talk to?",9,,
Umm-e-Haniya,00:18:32.000,رومی، میں جانتا ہوں کہ آپ مجھ سے ناراض ہیں,10,"Rumi, I know you are upset with me",8,,
Umm-e-Haniya,00:18:34.560,لیکن براہ کرم یہ سمجھنے کی کوشش کریں کہ,9,but please try to understand,5,,
Umm-e-Haniya,00:18:39.240,تم جانتے ہو کہ میں نے تمہارا کتنا انتظار کیا؟,10,You know how much I waited for you?,8,,
Umm-e-Haniya,00:18:41.240,سب پوچھتے رہے کہ کامل کہاں ہے؟,7,Everyone kept on asking where is Kamil.,7,,
Umm-e-Haniya,00:18:44.480,یہ اچھا ہوا کہ میں والد کے ساتھ ڈاکٹر کے پاس گیا،,12,"Its good that I went to the doctor with dad,",10,,
Umm-e-Haniya,00:18:47.480,اگر میں آپ کا انتظار کرتا تو,7,"if I would have waited for you,",7,,
